,tmdb_id,title,evaluation,Director_0,Adventure,Fantasy,Animation,Drama,Horror,Action,Comedy,History,Western,Thriller,Crime,Documentary,Science Fiction,Mystery,Music,Romance,Family,War,TV Movie,primary genre,overview,keywords
0,157336,Interstellar,9.89,Christopher Nolan,1,0,0,1,0,0,0,0,0,0,0,0,1,0,0,0,0,0,0,Adventure,The adventures of a group of explorers who make use of a newly discovered wormhole to surpass the limitations on human space travel and conquer the vast distances involved in an interstellar voyage.,artificial intelligence nasa spacecraft expedition future wormhole space travel famine time travel black hole dystopia race against time quantum mechanics space rescue family relationships robot astronaut scientist single father farmer space station space adventure father daughter relationship 
1,515001,Jojo Rabbit,8.9,Taika Waititi,0,0,0,1,0,0,1,0,0,0,0,0,0,0,0,0,0,1,0,Comedy,"A World War II satire that follows a lonely German boy whose world view is turned upside down when he discovers his single mother is hiding a young Jewish girl in their attic. Aided only by his idiotic imaginary friend, Adolf Hitler, Jojo must confront his blind nationalism.",based on novel or book world war ii jew persecution hitler youth imaginary friend satire single mother nazism 1940s child protagonist adolf hitler children in wartime 
2,334,Magnolia,9.98,Paul Thomas Anderson,0,0,0,1,0,0,0,0,0,0,0,0,0,0,0,0,0,0,0,Drama,"An epic mosaic of many interrelated characters in search of happiness, forgiveness, and meaning in the San Fernando Valley.",farewell loss of loved one regret parent child relationship suicide attempt becoming an adult dying and death chance child prodigy daughter unsociability reconciliation san fernando valley multiple storylines frog weird rain 
3,318846,The Big Short,9.52,Adam McKay,0,0,0,1,0,0,1,0,0,0,0,0,0,0,0,0,0,0,0,Comedy,The men who made millions from a global economic meltdown.,bank fraud biography wall street finances based on a true story animated scene breaking the fourth wall historical fiction loan financial crisis real estate mortgage 
4,76341,Mad Max: Fury Road,9.38,George Miller,1,0,0,0,0,1,0,0,0,0,0,0,1,0,0,0,0,0,0,Action,"An apocalyptic story set in the furthest reaches of our planet, in a stark desert landscape where humanity is broken, and most everyone is crazed fighting for the necessities of life. Within this world exist two rebels on the run who just might be able to restore order.",future chase post-apocalyptic future dystopia australia rescue survival on the run on the road convoy peak oil dark future 
5,64058,Single Bells,8.14,Xaver Schwarzenberger,0,0,0,0,0,0,1,0,0,0,0,0,0,0,0,0,0,0,0,Comedy,"Kati, successful advertising manager, dreams of a family with Jonas, who has been her boyfriend since eight years. As he doesn't like the plan at all, they start an argument. Kati finally decides to go to her sister Luise on Christmas instead of flying to Mauritius with Jonas. This turns out to be a bad idea because she isn't the only guest Luise's family has to bear... Kati, successful advertising manager, dreams of a family with Jonas, who has been her boyfriend since eight years. As he doesn't like the plan at all, they start an argument. Kati finally decides to go to her sister Luise on Christmas instead of flying to Mauritius with Jonas. This turns out to be a bad idea because she isn't the only guest Luise's family has to bear...",christmas 
6,120,The Lord of the Rings: The Fellowship of the Ring,9.4,Peter Jackson,1,1,0,0,0,1,0,0,0,0,0,0,0,0,0,0,0,0,0,Adventure,"Young hobbit Frodo Baggins, after inheriting a mysterious ring from his uncle Bilbo, must leave his home in order to keep it from falling into the hands of its evil creator. Along the way, a fellowship is formed to protect the ringbearer and make sure that the ring arrives at its final destination: Mt. Doom, the only place where it can be destroyed.",elves dwarf orcs hobbit loss of loved one based on novel or book river mountain mine fireworks castle volcano birthday party uncle addiction fugitive battle death blizzard wizard journey ring live action and animation sword and sorcery middle-earth 
7,19995,Avatar,8.959999999999999,James Cameron,1,1,0,0,0,1,0,0,0,0,0,0,1,0,0,0,0,0,0,Action,"In the 22nd century, a paraplegic Marine is dispatched to the moon Pandora on a unique mission, but becomes torn between following orders and protecting an alien civilization.",culture clash future space war space colony society space travel futuristic romance space alien tribe alien planet marine soldier battle love affair space opera anti war power relations mind and soul 
8,264660,Ex Machina,9.38,Alex Garland,0,0,0,1,0,0,0,0,0,0,0,0,1,0,0,0,0,0,0,Drama,"Caleb, a coder at the world's largest internet company, wins a competition to spend a week at a private mountain retreat belonging to Nathan, the reclusive CEO of the company. But when Caleb arrives at the remote location he finds that he will have to participate in a strange and fascinating experiment in which he must interact with the world's first true artificial intelligence, housed in the body of a beautiful robot girl.",dancing artificial intelligence distrust isolation technology manipulation friendship deception laboratory robot power outage surveillance camera consciousness existentialism lockdown philosophical turing test cybernetics female cyborg human android relationship 
9,5825,National Lampoon's Christmas Vacation,7.9,Jeremiah S. Chechik,0,0,0,0,0,0,1,0,0,0,0,0,0,0,0,0,0,0,0,Comedy,"It's Christmastime, and the Griswolds are preparing for a family seasonal celebration. But things never run smoothly for Clark, his wife Ellen, and their two kids. Clark's continual bad luck is worsened by his obnoxious family guests, but he manages to keep going, knowing that his Christmas bonus is due soon.",holiday boss family dinner neighbor domestic life fantasy sequence christmas christmas bonus jello 
10,122,The Lord of the Rings: The Return of the King,9.58,Peter Jackson,1,1,0,0,0,1,0,0,0,0,0,0,0,0,0,0,0,0,0,Adventure,"Aragorn is revealed as the heir to the ancient kings as he, Gandalf and the other members of the broken fellowship struggle to save Gondor from Sauron's forces. Meanwhile, Frodo and Sam take the ring closer to the heart of Mordor, the dark lord's realm.",elves dwarf orcs hobbit based on novel or book suspicion volcano bravery addiction honor royalty troll brutality ghost wizard quest live action and animation sword and sorcery middle-earth 
11,121,The Lord of the Rings: The Two Towers,9.72,Peter Jackson,1,1,0,0,0,1,0,0,0,0,0,0,0,0,0,0,0,0,0,Adventure,"Frodo and Sam are trekking to Mordor to destroy the One Ring of Power while Gimli, Legolas and Aragorn search for the orc-captured Merry and Pippin. All along, nefarious wizard Saruman awaits the Fellowship members at the Orthanc Tower in Isengard.",elves dwarf orcs hobbit based on novel or book explosive cave funeral siege fort army addiction mission attack dragon guide death split personality wizard ring live action and animation sword and sorcery middle-earth 
12,79384,O Palmenbaum,7.720000000000001,Xaver Schwarzenberger,0,0,0,0,0,0,1,0,0,0,0,0,0,0,0,1,1,0,1,Comedy,"Kati and Jonas have planned to get married secretly during their Christmas trip to Mauritius - but in the end, Kati's entire family gets wind of the plan and shows up at the airport to accompany them.",christmas 
13,78,Blade Runner,9.0,Ridley Scott,0,0,0,1,0,0,0,0,0,1,0,0,1,0,0,0,0,0,0,Science Fiction,"In the smog-choked dystopian Los Angeles of 2019, blade runner Rick Deckard is called out of retirement to terminate a quartet of replicants who have escaped to Earth seeking their creator for a way to extend their short life spans.","artificial intelligence flying car bounty hunter android based on novel or book dystopia genetics futuristic fugitive cyberpunk los angeles, california cult film tech noir neo-noir blade runner "
14,38602,Little Lord Fauntleroy,7.37,Jack Gold,0,0,0,1,0,0,0,0,0,0,0,0,0,0,0,0,1,0,1,TV Movie,"Young Cedric Errol and his widowed mother live in genteel poverty in 1880s Brooklyn after the death of his father. Cedric's grandfather, the Earl of Dorincourt, has long ago disowned his son for marrying an American. But after the death of the Earl's remaining son, he decides to accept Cedric as his heir.",remake lord 
15,567,Rear Window,8.870000000000001,Alfred Hitchcock,0,0,0,0,0,0,0,0,0,1,0,0,0,1,0,0,0,0,0,Thriller,A wheelchair-bound photographer spies on his neighbors from his apartment window and becomes convinced one of them has committed murder.,nurse photographer suspicion of murder girlfriend neighbor salesman whodunit convalescence voyeurism missing wife homebound suspicious behavior flower bed visiting nurse 
16,4192,Death on the Nile,8.8,John Guillermin,0,0,0,0,0,0,0,0,0,0,0,0,0,1,0,0,0,0,0,Mystery,"As Hercule Poirot enjoys a luxurious cruise down the Nile, a newlywed heiress is found murdered on board. Can Poirot identify the killer before the ship reaches the end of its journey?",based on novel or book egypt paddleboat pyramid cruise nile sphinx murder whodunit cobra shipboard murder mystery 1930s 
17,24,Kill Bill: Vol. 1,9.7,Quentin Tarantino,0,0,0,0,0,1,0,0,0,0,1,0,0,0,0,0,0,0,0,Action,"An assassin is shot by her ruthless employer, Bill, and other members of their assassination circle – but she lives to plot her vengeance.",japan coma martial arts kung fu showdown asia underworld yakuza sword bride vigilante sword fight revenge female yakuza animated scene wedding samurai sword eye patch retribution 
18,593,Solaris,8.47,Andrei Tarkovsky,0,0,0,1,0,0,0,0,0,0,0,0,1,1,0,0,0,0,0,Drama,A psychologist is sent to a space station orbiting a planet called Solaris to investigate the death of a doctor and the mental problems of cosmonauts on the station. He soon discovers that the water on the planet is a type of brain which brings out repressed memories and obsessions.,1970s loss of sense of reality extraterrestrial technology soviet union subconsciousness hallucination space travel astronaut 
19,110415,Snowpiercer,8.7,Bong Joon-ho,0,0,0,1,0,1,0,0,0,0,0,0,1,0,0,0,0,0,0,Action,"In a future where a failed global-warming experiment kills off most life on the planet, a class system evolves aboard the Snowpiercer, a train that travels around the globe via a perpetual-motion engine.",child labour parent child relationship brothel winter allegory bridge pregnancy post-apocalyptic future dystopia hijacking of train based on comic dam rifle train based on graphic novel guilt revolt duplicity tunnel social class population control perpetual winter city ruin 
20,517814,Capernaum,9.33,Nadine Labaki,0,0,0,1,0,0,0,0,0,0,0,0,0,0,0,0,0,0,0,Drama,"Zain, a 12-year-old boy scrambling to survive on the streets of Beirut, sues his parents for having brought him into such an unjust world, where being a refugee with no documents means that your rights can easily be denied.","slum child abuse lebanon refugee neglect beirut, lebanon lawsuit child bride undocumented immigrant poverty life in the slums slum dwellers "
21,393,Kill Bill: Vol. 2,8.77,Quentin Tarantino,0,0,0,0,0,1,0,0,0,1,1,0,0,0,0,0,0,0,0,Action,"The Bride unwaveringly continues on her roaring rampage of revenge against the band of assassins who had tried to kill her and her unborn child. She visits each of her former associates one-by-one, checking off the victims on her Death List Five until there's nothing left to do … but kill Bill.",sibling relationship martial arts kung fu showdown swordplay katana mother role rage and hate daughter right and justice vigilante single sword fight revenge retribution aftercreditsstinger duringcreditsstinger kill bill 
22,4645,Ödipussi,8.93,Vicco von Bülow,0,0,0,0,0,0,1,0,0,0,0,0,0,0,0,0,0,0,0,Comedy,"Paul Winkelmann is the CEO of a successful business in Hamburg that he took over after the death of his father eight years ago. But he is still strongly dominated by his 78 year old mother who cares for him as a child, and who cannot understand why he took an apartment on his own after all these years. The real ""problem"" starts when Paul gets to know psychologist Margarethe Tietze whose relationship to her parents is also not so easy after all.",milan mama's boy furniture 
23,335984,Blade Runner 2049,9.43,Denis Villeneuve,0,0,0,1,0,0,0,0,0,0,0,0,1,0,0,0,0,0,0,Science Fiction,"Thirty years after the events of the first film, a new blade runner, LAPD Officer K, unearths a long-buried secret that has the potential to plunge what's left of society into chaos. K's discovery leads him on a quest to find Rick Deckard, a former LAPD blade runner who has been missing for 30 years.","artificial intelligence bounty hunter future dystopia genetics sequel cyberpunk los angeles, california las vegas tech noir blade runner "
24,1255,The Host,9.33,Bong Joon-ho,0,0,0,1,1,0,0,0,0,0,0,0,1,0,0,0,0,0,0,Horror,"Following the dumping of gallons of toxic waste in the river, a giant mutated squid-like appears and begins attacking the populace. Gang-du's daughter Hyun-seo is snatched up by the creature; with his family to assist him, he sets off to find her.",river monster bravery archer daughter sewerage pollution formaldehyde snack bar family asian origins 
25,550,Fight Club,9.67,David Fincher,0,0,0,1,0,0,0,0,0,0,0,0,0,0,0,0,0,0,0,Drama,"A ticking-time-bomb insomniac and a slippery soap salesman channel primal male aggression into a shocking new form of therapy. Their concept catches on, with underground ""fight clubs"" forming in every town, until an eccentric gets in the way and ignites an out-of-control spiral toward oblivion.",based on novel or book support group dual identity nihilism fight rage and hate insomnia dystopia alter ego cult film split personality quitting a job dissociative identity disorder self destructiveness 
26,12086,Machuca,8.0,Andrés Wood,0,0,0,1,0,0,0,0,0,0,0,0,0,0,0,0,0,0,0,Drama,"Santiago, capital of Chile during the Marxist government of elected, highly controversial president Salvador Allende. Father McEnroe supports his leftist views by introducing a program at the prestigious ""collegio"" (Catholic prep school) St. Patrick to allow free admission of some proletarian kids. One of them is Pedro Machuca, slum-raised son of the cleaning lady in Gonzalo Infante's liberal-bourgeois home. Yet the new classmates become buddies, paradoxically protesting together as Gonzalo gets adopted by Pedro's slum family and gang. But the adults spoil that too, not in the least when general Pinochet's coup ousts Allende, and supporters such as McEnroe.","1970s demonstration trauma santiago, chile chile pinochet regime friends historical event classmate sexual initiation "
27,694,The Shining,8.9,Stanley Kubrick,0,0,0,0,1,0,0,0,0,1,0,0,0,0,0,0,0,0,0,Horror,"Jack Torrance accepts a caretaker job at the Overlook Hotel, where he, along with his wife Wendy and their son Danny, must live isolated from the rest of the world for the winter. But they aren't prepared for the madness that lurks within.","hotel montana based on novel or book isolation hotelier oregon, usa delusion loneliness caretaker vision psychological thriller writer alcoholic cult film psychological horror snowed in haunted hotel writers-block "
28,339877,Loving Vincent,9.05,Dorota Kobiela,0,0,1,1,0,0,0,1,0,0,0,0,0,1,0,0,0,0,0,Animation,A young man comes to the last hometown of painter Vincent van Gogh to deliver the troubled artist's final letter and ends up investigating his final days there.,painter artist letter investigation bullying struggling artist 19th century mysterious death controversial artist vincent van gogh 
29,507076,Climax,7.8,Gaspar Noé,0,0,0,1,1,0,0,0,0,0,0,0,0,0,1,0,0,0,0,Drama,Young dancers gather in a remote and empty school building to rehearse on a cold and wintry night. The all-night celebration soon turns into a hallucinatory nightmare when they learn that their sangria is laced with LSD.,dance paranoia pregnancy lsd long take urination lgbt spiked drink punch bowl 
30,9693,Children of Men,8.75,Alfonso Cuarón,0,0,0,1,0,1,0,0,0,1,0,0,1,0,0,0,0,0,0,Drama,"In 2027, in a chaotic world in which humans can no longer procreate, a former activist agrees to help transport a miraculously pregnant woman to a sanctuary at sea, where her child's birth may help scientists save the future of humankind.",police state england hippie rebel based on novel or book refugee camp miracle future dystopia chaos childlessness government faith survival birth alcoholic bombing dying fertility violence 
31,394117,The Florida Project,9.05,Sean Baker,0,0,0,1,0,0,0,0,0,0,0,0,0,0,0,0,0,0,0,Drama,"The story of a precocious six year-old and her ragtag group of friends whose summer break is filled with childhood wonder, possibility and a sense of adventure while the adults around them struggle with hard times.",parent child relationship florida drug addiction motel friendship drug use children's perspectives child walt disney world orlando florida peer relationship mother daughter relationship 
32,115,The Big Lebowski,9.05,Joel Coen,0,0,0,0,0,0,1,0,0,0,1,0,0,0,0,0,0,0,0,Comedy,"Jeffrey 'The Dude' Lebowski, a Los Angeles slacker who only wants to bowl and drink White Russians, is mistaken for another Jeffrey Lebowski, a wheelchair-bound millionaire, and finds himself dragged into a strange series of events involving nihilists, adult film producers, ferrets, errant toes, and large sums of money.","white russian bowling vietnam veteran carpet nihilism heart attack kidnapping lsd marijuana los angeles, california millionaire cult film cowboy ashes impregnation bowling team unemployed bowling ball neo-noir weeds "
33,452,The Idiots,7.75,Lars von Trier,0,0,0,1,0,0,1,0,0,0,0,0,0,0,0,0,0,0,0,Comedy,With his first Dogma-95 film director Lars von Trier opens up a completely new film platform. With a mix of home-video and documentary styles the film tells the story of a group of young people who have decided to get to know their “inner-idiots” and thus not only facing and breaking their outer appearance but also their inner.,mentally disabled lifestyle commune test of courage idiot publicity staging normality social control mockery simulation bodily disabled person psychology freedom coercion dogme 95 
34,771,Home Alone,8.0,Chris Columbus,0,0,0,0,0,0,1,0,0,0,0,0,0,0,0,0,1,0,0,Comedy,"Eight-year-old Kevin McCallister makes the most of the situation after his family unwittingly leaves him behind when they go on Christmas vacation. But when a pair of bungling burglars set their sights on Kevin's house, the plucky kid stands ready to defend his territory. By planting booby traps galore, adorably mischievous Kevin stands his ground as his frantic mother attempts to race home before Christmas Day.",holiday burglar slapstick little boy family relationships home invasion precocious child booby trap home alone suburban chicago mischievous child christmas kids on their own child rescue 
35,155,The Dark Knight,9.65,Christopher Nolan,0,0,0,1,0,1,0,0,0,1,1,0,0,0,0,0,0,0,0,Drama,"Batman raises the stakes in his war on crime. With the help of Lt. Jim Gordon and District Attorney Harvey Dent, Batman sets out to dismantle the remaining criminal organizations that plague the streets. The partnership proves to be effective, but they soon find themselves prey to a reign of chaos unleashed by a rising criminal mastermind known to the terrified citizens of Gotham as the Joker.",dc comics crime fighter secret identity anti hero scarecrow sadism chaos vigilante joker superhero based on comic tragic hero organized crime anti villain criminal mastermind district attorney super power super villain neo-noir 
36,107985,The World's End,8.0,Edgar Wright,0,0,0,0,0,1,1,0,0,0,0,0,1,0,0,0,0,0,0,Comedy,Five friends who reunite in an attempt to top their epic pub crawl from 20 years earlier unwittingly become humankind's only hope for survival.,addiction alcoholism end of the world apocalypse homage 
37,747,Shaun of the Dead,8.45,Edgar Wright,0,0,0,0,1,0,1,0,0,0,0,0,0,0,0,0,0,0,0,Horror,"Shaun lives a supremely uneventful life, which revolves around his girlfriend, his mother, and, above all, his local pub. This gentle routine is threatened when the dead return to life and make strenuous attempts to snack on ordinary Londoners.","london, england surrey satire slacker friends parody dark comedy survival zombie cult film survival horror british pub boyfriend girlfriend relationship zombie apocalypse "
38,359940,"Three Billboards Outside Ebbing, Missouri",8.85,Martin McDonagh,0,0,0,1,0,0,0,0,0,0,1,0,0,0,0,0,0,0,0,Crime,"After seven months have passed without a culprit in her daughter's murder case, Mildred Hayes makes a bold move, painting three signs leading into her town with a controversial message directed at Bill Willoughby, the town's revered chief of police. When his second-in-command Officer Jason Dixon, an immature mother's boy with a penchant for violence, gets involved, the battle between Mildred and Ebbing's law enforcement is only exacerbated.",suicide rape police brutality small town missouri alcoholism murder dark comedy cancer teenage girl arson police corruption racism anger billboard guilty conscience molotov cocktail pool hall 
39,603,The Matrix,10.0,Lilly Wachowski,0,0,0,0,0,1,0,0,0,0,0,0,1,0,0,0,0,0,0,Action,"Set in the 22nd century, The Matrix tells the story of a computer hacker who joins a group of underground insurgents fighting the vast and powerful computers who now rule the earth.",saving the world artificial intelligence man vs machine philosophy prophecy martial arts self sacrifice fight hacker insurgence simulated reality  virtual reality dystopia truth cyberpunk dream world woman director messiah action hero gnosticism 
40,116745,The Secret Life of Walter Mitty,8.5,Ben Stiller,1,1,0,1,0,0,1,0,0,0,0,0,0,0,0,0,0,0,0,Adventure,A timid magazine photo manager who lives life vicariously through daydreams embarks on a true-life adventure when a negative goes missing.,himalaya photographer magazine iceland daydream photograph shark fired from the job dreamer online dating daydreaming 
41,374720,Dunkirk,7.95,Christopher Nolan,0,0,0,1,0,1,0,0,0,0,0,0,0,0,0,0,0,1,0,War,"The story of the miraculous evacuation of Allied soldiers from Belgium, Britain, Canada and France, who were cut off and surrounded by the German army from the beaches and harbour of Dunkirk between May 26th and June 4th 1940 during World War II.",france beach europe world war ii evacuation pilot british army allies army royal navy based on a true story survival rescue mission military officer historical fiction soldier private military dunkirk 1940s royal air force raf 
42,64690,Drive,7.5,Nicolas Winding Refn,0,0,0,1,0,0,0,0,0,1,1,0,0,0,0,0,0,0,0,Drama,"Driver is a skilled Hollywood stuntman who moonlights as a getaway driver for criminals. Though he projects an icy exterior, lately he's been warming up to a pretty neighbor named Irene and her young son, Benicio. When Irene's husband gets out of jail, he enlists Driver's help in a million-dollar heist. The job goes horribly wrong, and Driver must risk his life to protect Irene and Benicio from the vengeful masterminds behind the robbery.","car mechanic stuntman revenge neighbor police chase beaten to death los angeles, california brutality getaway driver crime lord existentialism neo-noir silent protagonist "
43,16869,Inglourious Basterds,9.5,Quentin Tarantino,0,0,0,1,0,1,0,0,0,1,0,0,0,0,0,0,0,1,0,Drama,"In Nazi-occupied France during World War II, a group of Jewish-American soldiers known as ""The Basterds"" are chosen specifically to spread fear throughout the Third Reich by scalping and brutally killing Nazis. The Basterds, lead by Lt. Aldo Raine soon cross paths with a French-Jewish teenage girl who runs a movie theater in Paris which is targeted by the soldiers.","paris, france guerrilla warfare self sacrifice dynamite mexican standoff world war ii jew persecution nazi masochism sadism anti-semitism swastika german occupation of france british politics adolf hitler "
44,1726,Iron Man,8.05,Jon Favreau,1,0,0,0,0,1,0,0,0,0,0,0,1,0,0,0,0,0,0,Action,"After being held captive in an Afghan cave, billionaire engineer Tony Stark creates a unique weaponized suit of armor to fight evil.",middle east arms dealer malibu superhero based on comic iron man aftercreditsstinger marvel cinematic universe (mcu) counter-terrorism iron-man marvel comics comic book adaptation 
45,2013,The Diving Bell and the Butterfly,8.65,Julian Schnabel,0,0,0,1,0,0,0,0,0,0,0,0,0,0,0,0,0,0,0,Drama,"The true story of Elle France editor Jean-Dominique Bauby, who, in 1995 at the age of 43, suffered a stroke that paralyzed his entire body, except his left eye. Using that eye to blink out his memoir, Bauby eloquently described the aspects of his interior world, from the psychological torment of being trapped inside his body to his imagined stories from lands he'd only visited in his mind.",writing lover (female) psychological stress dying and death editor-in-chief patient disabled 
46,37903,The White Ribbon,8.0,Michael Haneke,0,0,0,1,0,0,0,0,0,0,0,0,0,1,0,0,0,0,0,Drama,"Strange events happen in a small village in the north of Germany during the years just before World War I, which seem to be ritual punishment. The abused and suppressed children of the villagers seem to be at the heart of this mystery.",child abuse authority pastor nanny propaganda puritan punishment tailor school teacher future war suppression shame small village village people 1910s east elbia violence 
