,tmdb_id,title,evaluation,Director_0,Adventure,Fantasy,Animation,Drama,Horror,Action,Comedy,History,Western,Thriller,Crime,Documentary,Science Fiction,Mystery,Music,Romance,Family,War,TV Movie,primary genre,overview,keywords
396,445,Caché,8.3,Michael Haneke,0,0,0,1,0,0,0,0,0,1,0,0,0,1,0,0,0,0,0,Mystery,A married couple is terrorized by a series of videotapes planted on their front porch.,"paris, france upper class puberty anonymous letter suppressed past confidence moderator menace lie algerian intellectual conscience videotape neo-noir "
397,469341,Damn Kids,6.3,Gonzalo Justiniano,0,0,0,1,0,0,0,0,0,0,0,0,0,0,0,0,0,0,0,Drama,"Chile, 1983. Gladys is a brave young woman who lives in La Victoria, a marginal neighborhood of Santiago with her mother and daughter during the Pinochet dictatorship. One day they receive a young missionary, Samuel Thompson, who, with his camera, records how the population lives in such an adverse scenario.",0
398,575807,By the Name of Tania,6.0,Bénédicte Liénard,0,0,0,0,0,0,0,0,0,0,0,1,0,0,0,0,0,0,0,Documentary,"The Amazon flows lazily through the goldmine-gashed landscape of northern Peru. Using real eyewitness accounts, directors Bénédicte Liénard and Mary Jiménez tell the story of a young woman who winds up in the clutches of forced prostitution when her initially hopeful attempt to escape the constrictions of her village goes wrong. Step by step, she is robbed of her moral and physical integrity. The film reconstitutes a space of dignity and returns voice and identity to a fate formally made nameless. With its powerful imagery, the girl’s traumatic odyssey embodies the destruction of life in a capitalist world in connection with horrific natural devastation.",0
399,11779,Buena Vista Social Club,6.7,Wim Wenders,0,0,0,0,0,0,0,0,0,0,0,1,0,0,1,0,0,0,0,Documentary,"In this fascinating Oscar-nominated documentary, American guitarist Ry Cooder brings together a group of legendary Cuban folk musicians (some in their 90s) to record a Grammy-winning CD in their native city of Havana. The result is a spectacular compilation of concert footage from the group's gigs in Amsterdam and New York City's famed Carnegie Hall, with director Wim Wenders capturing not only the music -- but also the musicians' life stories.",cuba havanna 
400,18533,Bronson,7.0,Nicolas Winding Refn,0,0,0,1,0,1,0,0,0,0,1,0,0,0,0,0,0,0,0,Drama,"A young man who was sentenced to 7 years in prison for robbing a post office ends up spending 30 years in solitary confinement. During this time, his own personality is supplanted by his alter ego, Charles Bronson.",prison isolation biography based on a true story solitary confinement breaking the fourth wall cult film 
401,164,Breakfast at Tiffany's,8.5,Blake Edwards,0,0,0,0,0,0,1,0,0,0,0,0,0,0,0,1,0,0,0,Comedy,"Holly Golightly is an eccentric New York City playgirl determined to marry a Brazilian millionaire. But when young writer Paul Varjak moves into her apartment building, her past threatens to get in their way.",new york city loss of loved one age difference cat broken engagement love of one's life cigarette jewelry store window millionaire 
402,68,Brazil,8.7,Terry Gilliam,0,0,0,0,0,0,1,0,0,0,0,0,1,0,0,0,0,0,0,Comedy,"Low-level bureaucrat Sam Lowry escapes the monotony of his day-to-day life through a recurring daydream of himself as a virtuous hero saving a beautiful damsel. Investigating a case that led to the wrongful arrest and eventual death of an innocent man instead of wanted terrorist Harry Tuttle, he meets the woman from his daydream, and in trying to help her gets caught in a web of mistaken identities, mindless bureaucracy and lies.",bureaucracy police state great britain office dream technology dystopia government satire surrealism steampunk dark comedy terrorism bombing cult film job promotion repairman christmas 
403,85350,Boyhood,7.0,Richard Linklater,0,0,0,1,0,0,0,0,0,0,0,0,0,0,0,0,0,0,0,Drama,"The film tells a story of a divorced couple trying to raise their young son. The story follows the boy for twelve years, from first grade at age 6 through 12th grade at age 17-18, and examines his relationship with his parents as he grows.",family's daily life college urban life high school growing up domestic abuse coming of age parenting divorce family divorced parents abusive husband 
404,525,The Blues Brothers,7.9,John Landis,0,0,0,0,0,1,1,0,0,0,1,0,0,0,1,0,0,0,0,Music,"Jake Blues, just released from prison, puts his old band back togther to save the Catholic home where he and his brother Elwood were raised.","dancing prison chicago, illinois country music nun jazz blues nazi concert music instrument shopping mall road trip church buddy parole "
405,487558,BlacKkKlansman,8.5,Spike Lee,0,0,0,1,0,0,1,1,0,0,1,0,0,0,0,0,0,0,0,Comedy,"Colorado Springs, late 1970s. Ron Stallworth, an African American police officer, and Flip Zimmerman, his Jewish colleague, run an undercover operation to infiltrate the Ku Klux Klan.",ku klux klan based on novel or book 1970s black panther party biography based on a true story undercover cop racism based on memoir or autobiography revisionist history white supremacy 
406,569547,Black Mirror: Bandersnatch,7.3,David Slade,0,0,0,1,0,0,0,0,0,1,0,0,1,1,0,0,0,0,1,Science Fiction,"In 1984, a young programmer begins to question reality as he adapts a dark fantasy novel into a video game. A mind-bending tale with multiple endings.",video game technology choice free will british noir tech noir programmer interactive choose your own adventure video game development 
407,405774,Bird Box,4.1,Susanne Bier,0,0,0,1,0,0,0,0,0,1,0,0,1,0,0,0,0,0,0,Thriller,"Five years after an ominous unseen presence drives most of society to suicide, a survivor and her two children make a desperate bid to reach safety.",based on novel or book post-apocalyptic future blindfold doomsday survival horror woman director white water rafting 
408,575659,Berlin Alexanderplatz,7.7,Burhan Qurbani,0,0,0,1,0,0,0,0,0,0,0,0,0,0,0,0,0,0,0,Drama,"An adaptation of Doblin's text to 2015 Berlin to tell the story of 30-year-old refugee Francis, the sole survivor of a boat which crossed the Mediterranean illegally. Without citizenship papers, Francis is drawn into the underbelly of the city.",remake 
409,582903,Echo,7.4,Rúnar Rúnarsson,0,0,0,1,0,0,0,0,0,0,0,0,0,0,0,0,0,0,0,Drama,"Through 56 independent scenes, Echo draws a portrait, both biting and tender, of modern day Iceland during the often turbulent but also exciting time of the Christmas holidays.",episodic movie 
410,1987,Benny's Video,7.2,Michael Haneke,0,0,0,1,0,0,0,0,0,1,1,0,0,0,0,0,0,0,0,Crime,"A 14-year-old video enthusiast is so caught up in film fantasy that he can no longer relate to the real world, to such an extent that he commits murder and records an on-camera confession for his parents.",parent child relationship austria bourgeoisie tunesia boys' choir wealth video store death videotape 
411,209112,Batman v Superman: Dawn of Justice,8.1,Zack Snyder,1,1,0,0,0,1,0,0,0,0,0,0,0,0,0,0,0,0,0,Action,"Fearing the actions of a god-like Super Hero left unchecked, Gotham City’s own formidable, forceful vigilante takes on Metropolis’s most revered, modern-day savior, while the world wrestles with what sort of hero it really needs. And with Batman and Superman at war with one another, a new threat quickly arises, putting mankind in greater danger than it’s ever known before.",dc comics vigilante superhero based on comic revenge leading man super power cities dc extended universe man vs man leading men 
412,272,Batman Begins,7.9,Christopher Nolan,0,0,0,1,0,1,0,0,0,0,1,0,0,0,0,0,0,0,0,Action,"Driven by tragedy, billionaire Bruce Wayne dedicates his life to uncovering and defeating the corruption that plagues his home, Gotham City.  Unable to work within the system, he instead creates a new identity, a symbol of fear for the criminal underworld - The Batman.",loss of loved one martial arts dc comics crime fighter secret identity undercover vigilante superhero based on comic rivalry tragic hero ninja super power haunted by the past evil doctor master villain unfulfilled love comic book adaptation 
413,446159,Bacurau,7.9,Kleber Mendonça Filho,0,0,0,0,0,0,0,0,1,1,0,0,0,1,0,0,0,0,0,Mystery,"Bacurau, a small town in the Brazilian sertão, mourns the loss of its matriarch, Carmelita, who lived to be 94. Days later, its inhabitants notice that their community has vanished from most maps.",transsexuality resistance autonomy colonialism sertão autonomia luta popular team work 
414,165,Back to the Future Part II,9.0,Robert Zemeckis,1,0,0,0,0,0,1,0,0,0,0,0,1,0,0,0,1,0,0,Adventure,"Marty and Doc are at it again in this wacky sequel to the 1985 blockbuster as the time-traveling duo head to 2015 to nip some McFly family woes in the bud. But things go awry thanks to bully Biff Tannen and a pesky sports almanac. In a last-ditch attempt to set things straight, Marty finds himself bound for 1955 and face to face with his teenage parents -- again.",skateboarding flying car car race delorean lightning guitar almanac inventor time travel sequel car crash diner alternate history thunderstorm walking cane tunnel high school dance hoverboard video phone 2010s hovercar 
415,105,Back to the Future,9.6,Robert Zemeckis,1,0,0,0,0,0,1,0,0,0,0,0,1,0,0,0,1,0,0,Adventure,"Eighties teenager Marty McFly is accidentally sent back in time to 1955, inadvertently disrupting his parents' first meeting and attracting his mother's romantic interest. Marty must repair the damage to history by rekindling his parents' romance and - with the help of his eccentric inventor friend Doc Brown - return to 1985.",clock tower flying car car race terrorist delorean lightning guitar plutonium sports car inventor journey in the past invention time travel race against time bullying partner misfit mad scientist fish out of water teenage love destiny hidden identity odd couple escapade disorder chases and races love and romance teenage life misfit partners changing the past or future getting home 1950s profanity 
416,339403,Baby Driver,6.5,Edgar Wright,0,0,0,0,0,1,0,0,0,0,1,0,0,0,0,0,0,0,0,Action,"After being coerced into working for a crime boss, a young getaway driver finds himself taking part in a heist doomed to fail.",robbery waitress atlanta getaway car crime boss romance heist on the run shootout long take bank robbery getaway driver sign languages armed robbery hearing impaired 
417,515042,Free Solo,7.0,Elizabeth Chai Vasarhelyi,1,0,0,0,0,0,0,0,0,0,0,1,0,0,0,0,0,0,0,Documentary,"Follow Alex Honnold as he attempts to become the first person to ever free solo climb Yosemite's 3,000 foot high El Capitan wall. With no ropes or safety gear, this would arguably be the greatest feat in rock climbing history.",mountain yosemite mountain climbing woman director free climbing rock climbing el capitan 
418,600,Full Metal Jacket,7.7,Stanley Kubrick,0,0,0,1,0,0,0,0,0,0,0,0,0,0,0,0,0,1,0,Drama,A pragmatic U.S. Marine observes the dehumanizing effects the U.S.-Vietnam War has on his fellow recruits from their brutal boot camp training to the bloody street fighting in Hue.,suicide prostitute helicopter based on novel or book journalism sniper propaganda vietnam vietnam war recruit war photographer war correspondent boot camp rescue jungle infantry sergeant racism genocide fighting platoon combat discipline u.s. marine obstacle course military anti war mass grave blanket party 
419,103686,Paradise: Love,7.3,Ulrich Seidl,0,0,0,1,0,0,0,0,0,0,0,0,0,0,0,0,0,0,0,Drama,"On the beaches of Kenya they're known as ""Sugar Mamas"" -- European women who seek out African boys selling love to earn a living. Teresa, a 50-year-old Austrian and mother of a daughter entering puberty, travels to this vacation paradise. She goes from one Beach Boy to the next, from one disappointment to the next and finally she must recognize: On the beaches of Kenya love is a business.",beach crocodile racial segregation kenya male prostitute class differences older woman younger man relationship 
420,24631,"Maria, ihm schmeckt's nicht!",6.0,Neele Vollmar,0,0,0,0,0,0,1,0,0,0,0,0,0,0,0,0,0,0,0,Comedy,"When Jan decides to marry his girl-friend Sara, he is not aware of his opponent: her father, who is an Italian.",woman director 
421,376867,Moonlight,7.4,Barry Jenkins,0,0,0,1,0,0,0,0,0,0,0,0,0,0,0,0,0,0,0,Drama,"The tender, heartbreaking story of a young man’s struggle to find himself, told across three defining chapters in his life as he experiences the ecstasy, pain, and beauty of falling in love, while grappling with his own sexuality.",drug abuse parent child relationship florida fight drug addiction restaurant drug dealer ghetto high school male homosexuality coming of age lgbt addict black lgbt gay theme gay 
422,417466,Monos,8.0,Alejandro Landes,0,0,0,1,0,0,0,0,0,0,0,0,0,0,0,0,0,1,0,Drama,"On a faraway mountaintop, eight kids with guns watch over a hostage and a conscripted milk cow.",mountain hostage child soldier guerilla latin america 
423,128,Princess Mononoke,8.2,Hayao Miyazaki,1,1,1,0,0,0,0,0,0,0,0,0,0,0,0,0,0,0,0,Adventure,"Ashitaka, a prince of the disappearing Emishi people, is cursed by a demonized boar god and must journey to the west to find a cure. Along the way, he encounters San, a young human woman fighting to protect the forest, and Lady Eboshi, who is trying to destroy it. Ashitaka must find a way to bring balance to this conflict.",fight wolf leprosy pan wild boar territory feral child friendship princess rural area decapitation spirit demon deforestation anime 
424,303858,Money Monster,7.5,Jodie Foster,0,0,0,1,0,0,0,0,0,1,0,0,0,0,0,0,0,0,0,Thriller,Financial TV host Lee Gates and his producer Patty are put in an extreme situation when an irate investor takes over their studio.,new york city bomb hostage sniper police hostage-taking stock market stock fraud woman director tv studio 
425,3082,Modern Times,7.5,Charlie Chaplin,0,0,0,1,0,0,1,0,0,0,0,0,0,0,0,0,0,0,0,Comedy,The Tramp struggles to live in modern industrial society with the help of a young homeless woman.,factory ambulance invention tramp great depression industrial revolution slapstick black and white machine pardon guilty silent film 
426,10510,Miracle on 34th Street,7.9,Les Mayfield,0,1,0,1,0,0,0,0,0,0,0,0,0,0,0,0,1,0,0,Fantasy,"Six-year-old Susan Walker has doubts about childhood's most enduring miracle—Santa Claus. Her mother told her the secret about Santa a long time ago, but, after meeting a special department store Santa who's convinced he's the real thing, Susan is given the most precious gift of all—something to believe in.",holiday competition new love santa claus department store miracle wish remake christmas 
427,582885,Cuties,7.8,Maïmouna Doucouré,0,0,0,1,0,0,0,0,0,0,0,0,0,0,0,0,0,0,0,Drama,"Amy, an 11-year-old girl, joins a group of dancers named “the cuties” at school, and rapidly grows aware of her burgeoning femininity—upsetting her mother and her values in the process.",dancing femininity woman director child 
428,11327,Midnight Express,7.4,Alan Parker,0,0,0,1,0,0,0,0,0,0,1,0,0,0,0,0,0,0,0,Drama,"Billy Hayes is caught attempting to smuggle drugs out of Turkey. The Turkish courts decide to make an example of him, sentencing him to more than 30 years in prison. Hayes has two opportunities for release: the appeals made by his lawyer, his family, and the American government, or the ""Midnight Express"".","prison airport 1970s drug smuggling attempt to escape court based on a true story escape lawyer torture hashish brutality masturbation istanbul, turkey "
429,19,Metropolis,7.0,Fritz Lang,0,0,0,1,0,0,0,0,0,0,0,0,1,0,0,0,0,0,0,Drama,"In a futuristic city sharply divided between the working class and the city planners, the son of the city's mastermind falls in love with a working class prophet who predicts the coming of a savior to mediate their differences.",man vs machine based on novel or book underground world inventor metropolis future class society dystopia tower of babel delirium steampunk mad scientist prophet black and white robot destruction silent film expressionism seven deadly sins depravity mob justice downtrodden saviour social unrest german expressionism mediator 
430,11423,Memories of Murder,7.9,Bong Joon-ho,0,0,0,1,0,0,0,0,0,1,1,0,0,0,0,0,0,0,0,Crime,"1986 Gyunggi Province. The body of a young woman is found brutally raped and murdered. Two months later, a series of rapes and murders commences under similar circumstances. And in a country that had never known such crimes, the dark whispers about a serial murderer grow louder. A special task force is set up in the area, with two local detectives Park Doo-Man and Jo Young-Goo joined by a detective from Seoul who requested to be assigned to the case.",corruption rape detective assassin victim investigation police based on a true story murder based on play or musical serial killer torture brutality killer neo-noir 
431,77,Memento,8.8,Christopher Nolan,0,0,0,0,0,0,0,0,0,1,0,0,0,1,0,0,0,0,0,Mystery,"Leonard Shelby is tracking down the man who raped and murdered his wife. The difficulty of locating his wife's killer, however, is compounded by the fact that he suffers from a rare, untreatable form of short-term memory loss. Although he can recall details of life before his accident, Leonard cannot remember what happened fifteen minutes ago, where he's going, or why.","insulin tattoo waitress amnesia drug dealer motel manipulation insurance salesman revenge murder flashback confusion memory loss psychological thriller whodunit los angeles, california polaroid cult film nonlinear timeline individuality phone call neo-noir reverse chronology "
432,10830,Matilda,6.3,Danny DeVito,0,1,0,0,0,0,1,0,0,0,0,0,0,0,0,0,1,0,0,Comedy,An extraordinarily intelligent young girl from a cruel and uncaring family discovers she possesses telekinetic powers and is sent off to a school headed by a tyrannical principal.,based on novel or book parent child relationship difficult childhood telekinesis child prodigy childhood trauma school teacher student relationship schoolmarm based on young adult novel 
433,506,Marnie,7.4,Alfred Hitchcock,0,0,0,1,0,0,0,0,0,1,1,0,0,1,0,1,0,0,0,Crime,"Marnie is a thief, a liar, and a cheat. When her new boss, Mark Rutland, catches on to her routine kleptomania, she finds herself being blackmailed.","philadelphia, pennsylvania post traumatic stress disorder prostitute rape horse race sexual abuse in love with enemy suicide attempt clerk blackmail sexual frustration lie horseback riding women's sexual identity new identity kleptomania baltimore, usa horse frigidity honeymoon fetish riding accident cruise psychology self-defense fetishism chase cowardliness "
434,382127,Manifesto,6.7,Julian Rosefeldt,0,0,0,1,0,0,0,0,0,0,0,0,0,0,0,0,0,0,0,Drama,"An outstanding tribute to various (art) manifestos of the nineteenth and twentieth century, ranging from Communism to Dogme, in connection with thirteen different characters, including a homeless man, a factory worker and a corporate CEO, who are all played by Cate Blanchett. A striking humorous audio-visual experience.",art manifesto 
435,9385,The Twelve Tasks of Asterix,7.7,René Goscinny,1,0,1,0,0,0,1,0,0,0,0,0,0,0,0,0,1,0,0,Family,"Asterix and Obelix depart on an adventure to complete twelve impossible tasks to prove to Caesar that they are as strong as the Gods. You'll roar with laughter as they outwit, outrun, and generally outrage the very people who are trying to prove them ""only human"".","rome, italy gladiator roman empire mythology magic roman ancient rome village cartoon based on comic alternate history historical fiction 1st century celts centurions "
436,334541,Manchester by the Sea,8.3,Kenneth Lonergan,0,0,0,1,0,0,0,0,0,0,0,0,0,0,0,0,0,0,0,Drama,"After his older brother passes away, Lee Chandler is forced to return home to care for his 16-year-old nephew. There he is compelled to deal with a tragic past that separated him from his family and the community where he was born and raised.","boat sadness boston, massachusetts massachusetts funeral brother loss grief dysfunctional family hospital house fire death nephew ex-wife nonlinear timeline mental health ex-husband ex-wife relationship legal guardian dysfunctional life "
437,505192,Shoplifters,6.8,Hirokazu Kore-eda,0,0,0,1,0,0,0,0,0,0,0,0,0,0,0,0,0,0,0,Drama,"After one of their shoplifting sessions, Osamu and his son come across a little girl in the freezing cold. At first reluctant to shelter the girl, Osamu’s wife agrees to take care of her after learning of the hardships she faces. Although the family is poor, barely making enough money to survive through petty crime, they seem to live happily together until an unforeseen incident reveals hidden secrets, testing the bonds that unite them.","secret family relationships family drama tokyo, japan poverty orphan shoplifting social realism shoplifter petty crimes asian origins "
438,49521,Man of Steel,8.0,Zack Snyder,1,1,0,0,0,1,0,0,0,0,0,0,1,0,0,0,0,0,0,Action,"A young boy learns that he has extraordinary powers and is not of this earth. As a young man, he journeys to discover where he came from and what he was sent here to do. But the hero in him must emerge if he is to save the world from annihilation and become the symbol of hope for all mankind.",saving the world dc comics places and planets superhero based on comic alien planet superhuman planet alien invasion super power mysterious force reboot dc extended universe 
439,615667,Ma Rainey's Black Bottom,7.0,George C. Wolfe,0,0,0,1,0,0,0,0,0,0,0,0,0,0,1,0,0,0,0,Drama,Tensions rise when the trailblazing Mother of the Blues and her band gather at a Chicago recording studio in 1927. Adapted from August Wilson's play.,"chicago, illinois recording studio lesbian relationship based on play or musical singer lgbt blues music black lgbt trumpet player 1920s "
440,832,M,8.2,Fritz Lang,0,0,0,1,0,1,0,0,0,1,1,0,0,0,0,0,0,0,0,Drama,"In this classic German thriller, Hans Beckert, a serial killer who preys on children, becomes the focus of a massive Berlin police manhunt. Beckert's heinous crimes are so repellant and disruptive to city life that he is even targeted by others in the seedy underworld network. With both cops and criminals in pursuit, the murderer soon realizes that people are on his trail, sending him into a tense, panicked attempt to escape justice.","germany berlin, germany underworld child murder detective inspector investigation psychopath organized crime black and white criminal child killer pre-code psycho expressionism german expressionism "
441,399170,Logan Lucky,6.1,Steven Soderbergh,0,0,0,1,0,1,1,0,0,0,1,0,0,0,0,0,0,0,0,Action,"Trying to reverse a family curse, brothers Jimmy and Clyde Logan set out to execute an elaborate robbery during the legendary Coca-Cola 600 race at the Charlotte Motor Speedway.",sibling relationship north carolina cockroach heist racecar driver nascar prison break 
442,371447,Lovesong,6.0,So Yong Kim,0,0,0,1,0,0,0,0,0,0,0,0,0,0,0,1,0,0,0,Drama,"Neglected by her husband, Sarah embarks on an impromptu road trip with her young daughter and her best friend, Mindy. Along the way, the dynamic between the two friends intensifies before circumstances force them apart. Years later, Sarah attempts to rebuild their intimate connection in the days before Mindy’s wedding.",female friendship road trip loneliness wedding unspoken love woman director 
443,292431,Love,8.0,Gaspar Noé,0,0,0,1,0,0,0,0,0,0,0,0,0,0,0,1,0,0,0,Drama,"Murphy is an American living in Paris who enters a highly sexually and emotionally charged relationship with the unstable Electra. Unaware of the seismic effect it will have on their relationship, they invite their pretty neighbor into their bed.","paris, france sexuality gallery pregnancy girlfriend love relationship break-up "
444,409520,Lommbock,7.9,Christian Zübert,0,0,0,0,0,0,1,0,0,0,0,0,0,0,0,0,0,0,0,Comedy,Sequel to Lammbock. Stefan and Kai meet again after years. Stefan became a successful lawyer in Dubai while Kai is stuck in their home town. Kai has relationship issues and is trying hard to get in touch with his step son who is getting in serious trouble with some drug dealers. Can Kai and Stefan solve his problems? And what happened to their old friend Frank?,sequel buddy stoner movie 
445,263115,Logan,7.0,James Mangold,0,0,0,1,0,1,0,0,0,0,0,0,1,0,0,0,0,0,0,Action,"In the near future, a weary Logan cares for an ailing Professor X in a hideout on the Mexican border. But Logan's attempts to hide from the world and his legacy are upended when a young mutant arrives, pursued by dark forces.",cyborg experiment self-destruction mutant future dystopia immortality road trip sequel superhero based on comic super power neo-western troubled past life on the margin marvel comics wolverine 
446,773,Little Miss Sunshine,8.5,Jonathan Dayton,0,0,0,1,0,0,1,0,0,0,0,0,0,0,0,0,0,0,0,Comedy,"A family loaded with quirky, colorful characters piles into an old van and road trips to California for little Olive to compete in a beauty pageant.",sibling relationship california husband wife relationship family's daily life highway literature professor beauty contest beauty queen contest road trip family relationships family holiday road movie woman director beauty pageant 
447,390,Lisbon Story,6.0,Wim Wenders,0,0,0,1,0,0,0,0,0,0,0,0,0,0,1,0,0,0,0,Drama,Lisbon Story is Wim Wenders' homage to Lisbon and films. A sound engineer obtains a mysterious postcard from a friend who at the moment is filming a film in Lisbon. He sets out across Europe to find him and help him.,"upper class city portrait movie business famous score lisbon, portugal life planning camera car journey amusement park "
