,tmdb_id,title,evaluation,Director_0,Adventure,Fantasy,Animation,Drama,Horror,Action,Comedy,History,Western,Thriller,Crime,Documentary,Science Fiction,Mystery,Music,Romance,Family,War,TV Movie,primary genre,overview,keywords
254,620897,The Forty-Year-Old Version,7.0,Radha Blank,0,0,0,1,0,0,1,0,0,0,0,0,0,0,1,0,0,0,0,Comedy,"Desperate for a breakthrough as she nears the big 4-0, struggling New York City playwright Radha finds inspiration by reinventing herself as a rapper.",new york city rap music rapper playwright writing class woman director struggling playwright 
255,300673,The Finest Hours,5.9,Craig Gillespie,0,0,0,1,0,1,0,1,0,1,0,0,0,0,0,0,0,0,0,Action,The Coast Guard makes a daring rescue attempt off the coast of Cape Cod after a pair of oil tankers are destroyed during a blizzard in 1952.,coast guard based on a true story survival rescue mission storm at sea sinking ship 1950s 
256,18,The Fifth Element,8.7,Luc Besson,1,1,0,0,0,1,0,0,0,1,0,0,1,0,0,0,0,0,0,Adventure,"In 2257, a taxi driver is unintentionally given the task of saving a young girl who is part of the key that will ensure the survival of humanity.",new york city flying car clone taxi cyborg egypt future stowaway space travel dystopia race against time arms dealer love alien priest end of the world shootout police chase cab driver cyberpunk cult film archaeologist space opera military opera singer resort hotel futuristic city ancient evil cruise liner good versus evil hovercar 
257,375262,The Favourite,7.1,Yorgos Lanthimos,0,0,0,1,0,0,1,0,0,0,0,0,0,0,0,0,0,0,0,Drama,"England, early 18th century. The close relationship between Queen Anne and Sarah Churchill is threatened by the arrival of Sarah's cousin, Abigail Hill, resulting in a bitter rivalry between the two cousins to be the Queen's favourite.",great britain queen rivalry rabbit lgbt 18th century duchess aristocracy british monarchy war of the spanish succession drop disease 
258,298382,The Dressmaker,6.1,Jocelyn Moorhouse,0,0,0,1,0,0,1,0,1,0,0,0,0,0,0,0,0,0,0,Drama,"In 1950s Australia, beautiful, talented dressmaker Tilly returns to her tiny hometown to right wrongs from her past. As she tries to reconcile with her mother, she starts to fall in love while transforming the fashion of the town.",based on novel or book small town exile australia dressmaker mystery hometown woman director accused of murder 1950s town gossip 
259,371638,The Disaster Artist,9.2,James Franco,0,0,0,1,0,0,1,0,0,0,0,0,0,0,0,0,0,0,0,Comedy,"An aspiring actor in Hollywood meets an enigmatic stranger by the name of Tommy Wiseau, the meeting leads the actor down a path nobody could have predicted; creating the worst movie ever made.",based on novel or book jealousy immigrant ambition biography based on a true story behind the scenes disaster hollywood desire wealthy man strange behavior strange person socially awkward film production bad acting 
260,1422,The Departed,8.3,Martin Scorsese,0,0,0,1,0,0,0,0,0,1,1,0,0,0,0,0,0,0,0,Drama,"To take down South Boston's Irish Mafia, the police send in one of their own to infiltrate the underworld, not realizing the syndicate has done likewise. While an undercover cop curries favor with the mob kingpin, a career criminal rises through the police ranks. But both sides soon discover there's a mole among them.","undercover boston, massachusetts gangster police friends remake mafia undercover cop mobster mole state police police training realtor "
261,535581,The Dead Don't Die,6.7,Jim Jarmusch,0,1,0,0,1,0,1,0,0,0,0,0,0,0,0,0,0,0,0,Comedy,"In a small peaceful town, zombies suddenly rise to terrorize the town. Now three bespectacled police officers and a strange Scottish morgue expert must band together to defeat the undead.","pennsylvania, usa cemetery small town hermit recycling diner b movie breaking the fourth wall zombie police officer horror comedy "
262,10200,The Day the Earth Stood Still,6.5,Scott Derrickson,0,0,0,1,0,0,0,0,0,1,0,0,1,0,0,0,0,0,0,Drama,"A representative of an alien race that went through drastic evolution to survive its own climate change, Klaatu comes to Earth to assess whether humanity can prevent the environmental damage they have inflicted on their own planet. When barred from speaking to the United Nations, he decides humankind shall be exterminated so the planet can survive.",extraterrestrial technology spacecraft ultimatum evacuation panic government remake ufo alien end of the world giant robot tank social commentary power outage interrogation environmentalism threat alien contact central park messenger nanobots disintegration 
263,1724,The Incredible Hulk,6.8,Louis Leterrier,1,0,0,0,0,1,0,0,0,0,0,0,1,0,0,0,0,0,0,Science Fiction,"Scientist Bruce Banner scours the planet for an antidote to the unbridled force of rage within him: the Hulk. But when the military masterminds who dream of exploiting his powers force him back to civilization, he finds himself coming face to face with a new, deadly foe.",new york city rio de janeiro superhero based on comic on the run fugitive super soldier scientist virginia military super villain marvel cinematic universe (mcu) angry bruce banner radical transformation marvel comics good versus evil 
264,9325,The Jungle Book,8.0,Wolfgang Reitherman,1,0,1,0,0,0,0,0,0,0,0,0,0,0,0,0,1,0,0,Family,"The boy Mowgli makes his way to the man-village with Bagheera, the wise panther. Along the way he meets jazzy King Louie, the hypnotic snake Kaa and the lovable, happy-go-lucky bear Baloo, who teaches Mowgli ""The Bare Necessities"" of life and the true meaning of friendship.",based on novel or book narration human animal relationship musical feral child jungle anthropomorphism orphan india animal lead 
265,11395,The Santa Clause,6.0,John Pasquin,0,1,0,1,0,0,1,0,0,0,0,0,0,0,0,0,1,0,0,Fantasy,"Scott Calvin is an ordinary man, who accidentally causes Santa Claus to fall from his roof on Christmas Eve and is knocked unconscious. When he and his young son finish Santa's trip and deliveries, they go to the North Pole, where Scott learns he must become the new Santa and convince those he loves that he is indeed, Father Christmas.","holiday chicago, illinois christmas party santa claus deal christmas tree child custody christmas father son relationship christmas eve "
266,605,The Matrix Revolutions,6.5,Lilly Wachowski,1,0,0,0,0,1,0,0,0,1,0,0,1,0,0,0,0,0,0,Adventure,The human city of Zion defends itself against the massive invasion of the machines as Neo fights to end the war at another front while also opposing the rogue Agent Smith.,saving the world artificial intelligence man vs machine flying philosophy fortune teller martial arts kung fu underground world killer robot temple subway dream sun hero fight sunlight computer virus key future precognition super computer machine town ying yang dying and death virtual reality dystopia computer faith truth rescue mission cyberpunk woman director action hero yin yang gnosticism 
267,281957,The Revenant,8.1,Alejandro González Iñárritu,1,0,0,1,0,0,0,0,1,0,0,0,0,0,0,0,0,0,0,Western,"In the 1820s, a frontiersman, Hugh Glass, sets out on a path of vengeance against those who left him for dead after a bear mauling.",rape based on novel or book parent child relationship mountain winter grizzly bear wilderness forest fur trapping frontier liar based on a true story remake revenge murder gore native american survival bear snow scalping wild west bear attack indian attack dead horse starvation 19th century final battle wolves dreamy child killing 
268,562900,The Red Phallus,7.7,Tashi Gyeltshen,0,0,0,1,0,0,0,0,0,0,0,0,0,0,0,0,0,0,0,Drama,"Sangai, a teenage girl living with her father in a village of inland Bhutan, is not happy with her father, who makes wooden phalluses, believed to have mysterious power, and playing a festival clown with a red mask at a local festival. She reluctantly delivers the phalluses to neighbors but she is followed by dozens of men with red masks and costumes when walking through the hill. Conflict and tension grows between the father, who has concerns about his successor, and Sangai, who has a clandestine relationship with a married man.",0
269,444686,The Raid,8.4,Kevin Michael Johnson,0,0,0,0,0,0,0,0,0,0,0,1,0,0,0,0,0,0,0,Documentary,"Blizzard Entertainment's critically-acclaimed 'World of Warcraft' is a virtual home to over twelve million subscribers. 'The Raid' follows a group of nine gamers as they find adventure, challenge, and community inside Azeroth. Hear from them the reasons why they devote their time and resources into pursuing this complex, collaborative, and communal experience.",0
270,600583,The Power of the Dog,7.9,Jane Campion,0,0,0,1,0,0,0,0,1,0,0,0,0,0,0,0,0,0,0,Drama,"A domineering but charismatic rancher wages a war  of intimidation on his brother's new wife and her teen son, until long-hidden secrets come to light.",montana sexuality based on novel or book husband wife relationship eroticism banjo ranch cigarette widow sadism marriage bullying death of father western sexual tension period drama masturbation alcoholic humiliation gender roles cowboy homoeroticism misogynist mentor protégé relationship woman director medical student drunkenness masculinity animal cruelty 1920s hula hoop mother son relationship brother brother relationship toxic masculinity gay slur repressed sexuality brothers repressed homosexuality homosexual subtext homosexuality 20th century 
271,446354,The Post,7.1,Steven Spielberg,0,0,0,1,0,0,0,1,0,0,0,0,0,0,0,0,0,0,0,Drama,A cover-up that spanned four U.S. Presidents pushed the country's first female newspaper publisher and a hard-driving editor to join an unprecedented battle between journalist and government. Inspired by true events.,"washington dc, usa journalism newspaper 1970s vietnam war biography politics richard nixon based on a true story pentagon papers government cover-up publisher political thriller "
272,1630,The People vs. Larry Flynt,7.5,Miloš Forman,0,0,0,1,0,0,0,0,0,0,0,0,0,0,0,0,0,0,0,Drama,"Larry Flynt is the hedonistically obnoxious, but indomitable, publisher of Hustler magazine. The film recounts his struggle to make an honest living publishing his girlie magazine and how it changes into a battle to protect the freedom of speech for all people.",poison pornography free love aids eroticism drug addiction group sex wheelchair last judgment court case sentence airplane baptism vulgar millionaire disabled 
273,399796,Life of the Party,7.3,Ben Falcone,0,0,0,0,0,0,1,0,0,0,0,0,0,0,0,0,0,0,0,Comedy,"When her husband suddenly dumps her, longtime dedicated housewife Deanna turns regret into re-set by going back to college... landing in the same class and school as her daughter, who's not entirely sold on the idea. Plunging headlong into the campus experience, the increasingly outspoken Deanna – now Dee Rock – embraces freedom, fun and frat boys on her own terms, finding her true self in a senior year no one ever expected.",housewife college daughter 
274,429203,The Old Man & the Gun,5.6,David Lowery,0,0,0,1,0,0,1,0,0,0,1,0,0,0,0,0,0,0,0,Comedy,"The true story of Forrest Tucker, from his audacious escape from San Quentin at the age of 70 to an unprecedented string of heists that confounded authorities and enchanted the public. Wrapped up in the pursuit are a detective, who becomes captivated with Forrest’s commitment to his craft, and a woman, who loves him in spite of his chosen profession.","bank texas fbi based on a true story heist bank robbery assumed identity horse ranch prison break neo-noir 1980s septuagenarian american midwest based on magazine, newspaper or article nonviolent offender finger gun smile "
275,1734,The Mummy Returns,7.4,Stephen Sommers,1,1,0,0,0,1,0,0,0,0,0,0,0,0,0,0,0,0,0,Adventure,"Rick and Evelyn O’Connell, along with their 8-year-old son Alex, discover the key to the legendary Scorpion King’s might: the fabled Bracelet of Anubis. Unfortunately, a newly resurrected Imhotep has designs on the bracelet as well, and isn’t above kidnapping its new bearer, Alex, to gain control of Anubis’s otherworldly army.",egypt pyramid mummy nile son tomb ancient egypt bracelet 1930s egyptian tomb good versus evil 
276,564,The Mummy,7.7,Stephen Sommers,1,1,0,0,0,1,0,0,0,0,0,0,0,0,0,0,0,0,0,Adventure,Dashing legionnaire Rick O'Connell stumbles upon the hidden ruins of Hamunaptra while in the midst of a battle to claim the area in 1920s Egypt. It has been over three thousand years since former High Priest Imhotep suffered a fate worse than death as a punishment for a forbidden love—along with a curse that guarantees eternal doom upon the world if he is ever awoken.,library secret passage cairo egypt pastor pyramid sandstorm solar eclipse mummy foreign legion nile secret society treasure hunt remake archaeologist tomb book of the dead ancient egypt opposites attract 1920s pharoah good versus evil 
277,504172,The Mule,6.5,Clint Eastwood,0,0,0,1,0,0,0,0,0,1,1,0,0,0,0,0,0,0,0,Crime,"Earl Stone, a man in his eighties, is broke, alone, and facing foreclosure of his business when he is offered a job that simply requires him to drive. Easy enough, but, unbeknownst to Earl, he's just signed on as a drug courier for a Mexican cartel. He does so well that his cargo increases exponentially, and Earl hit the radar of hard-charging DEA agent Colin Bates.","mexico drug crime drug mule based on a true story drug cartel dea agent korean war veteran based on magazine, newspaper or article 2000s sinaloa "
278,1653,The Motorcycle Diaries,6.8,Walter Salles,0,0,0,1,0,0,0,0,0,0,0,0,0,0,0,0,0,0,0,Drama,"Based on the journals of Che Guevara, leader of the Cuban Revolution. In his memoirs, Guevara recounts adventures he and best friend Alberto Granado had while crossing South America by motorcycle in the early 1950s.",revolution communist asthma peru chile cuban revolution che guevara argentina motorcycle guajira peninsula leper colony biochemist road movie 
279,6028,The Mirror Crack'd,6.3,Guy Hamilton,0,0,0,0,0,0,0,0,0,1,1,0,0,1,0,0,0,0,0,Crime,Jane Marple solves the mystery when a local woman is poisoned and a visiting movie star seems to have been the intended victim.,detective death movie star murder mystery 
280,624860,The Matrix Resurrections,7.4,Lana Wachowski,1,0,0,0,0,1,0,0,0,0,0,0,1,0,0,0,0,0,0,Science Fiction,"Plagued by strange memories, Neo's life takes an unexpected turn when he finds himself back inside the Matrix.",artificial intelligence man vs machine prophecy underground world future virtual reality dystopia computer cyberpunk aftercreditsstinger dream world woman director gnosticism 
281,278927,The Jungle Book,6.0,Jon Favreau,1,1,0,1,0,0,0,0,0,0,0,0,0,0,0,0,1,0,0,Family,"A man-cub named Mowgli fostered by wolves. After a threat from the tiger Shere Khan, Mowgli is forced to flee the jungle, by which he embarks on a journey of self discovery with the help of the panther, Bagheera and the free-spirited bear, Baloo.",based on novel or book snake wolf elephant tiger feral child panther remake bear jungle anthropomorphism orphan ape monkey animal talking to animals climbing a tree live action and animation live action remake 
282,604,The Matrix Reloaded,7.2,Lilly Wachowski,1,0,0,0,0,1,0,0,0,1,0,0,1,0,0,0,0,0,0,Adventure,"Six months after the events depicted in The Matrix, Neo has proved to be a good omen for the free humans, as more and more humans are being freed from the matrix and brought to Zion, the one and only stronghold of the Resistance.  Neo himself has discovered his superpowers including super speed, ability to see the codes of the things inside the matrix and a certain degree of pre-cognition. But a nasty piece of news hits the human resistance: 250,000 machine sentinels are digging to Zion and would reach them in 72 hours. As Zion prepares for the ultimate war, Neo, Morpheus and Trinity are advised by the Oracle to find the Keymaker who would help them reach the Source.  Meanwhile Neo's recurrent dreams depicting Trinity's death have got him worried and as if it was not enough, Agent Smith has somehow escaped deletion, has become more powerful than before and has fixed Neo as his next target.",saving the world artificial intelligence man vs machine prophecy martial arts kung fu underground world dream hero fight computer virus key future plato precognition rave dying and death virtual reality dystopia computer faith truth car crash mission cyberpunk woman director action hero gnosticism oracle 
283,286217,The Martian,8.0,Ridley Scott,1,0,0,1,0,0,0,0,0,0,0,0,1,0,0,0,0,0,0,Drama,"During a manned mission to Mars, Astronaut Mark Watney is presumed dead after a fierce storm and left behind by his crew. But Watney has survived and finds himself stranded and alone on the hostile planet. With only meager supplies, he must draw upon his ingenuity, wit and spirit to subsist and find a way to signal to Earth that he is alive.",based on novel or book planet mars nasa isolation spacecraft botanist alone stranded space engineering survival astronaut struggle for survival duringcreditsstinger deep space potatoes 
284,297725,The Man Who Killed Don Quixote,4.5,Terry Gilliam,1,1,0,1,0,0,1,0,0,0,0,0,0,0,0,0,0,0,0,Adventure,"Toby, a cynical film director finds himself trapped in the outrageous delusions of an old Spanish shoe-maker who believes himself to be Don Quixote. In the course of their comic and increasingly surreal adventures, Toby is forced to confront the tragic repercussions of a film he made in his idealistic youth.",based on novel or book 
285,4553,The Machinist,7.7,Brad Anderson,0,0,0,1,0,0,0,0,0,1,0,0,0,0,0,0,0,0,0,Thriller,"The Machinist is the story of Trevor Reznik, a lathe-operator who is suffering from insomnia. In a machine shop, occupational hazards are bad enough under normal circumstances; yet for Trevor the risks are compounded by fatigue. Trevor has lost the ability to sleep. This is no ordinary insomnia...",factory insomnia post it machinist osha taunting manhole one armed man torment mother's day losing weight old photograph dostoevsky 
286,330,The Lost World: Jurassic Park,7.1,Steven Spielberg,1,0,0,0,0,1,0,0,0,0,0,0,1,0,0,0,0,0,0,Adventure,"Four years after Jurassic Park's genetically bred dinosaurs ran amok, multimillionaire John Hammond shocks chaos theorist Ian Malcolm by revealing that he has been breeding more beasties at a secret location. Malcolm, his paleontologist ladylove and a wildlife videographer join an expedition to document the lethal lizards' natural behavior in this action-packed thriller.","exotic island dna paleontology tyrannosaurus rex velociraptor san diego, california island dinosaur creature scientist amusement park theme park costa rica animal horror father daughter relationship "
287,554230,The Lost Daughter,7.6,Maggie Gyllenhaal,0,0,0,1,0,0,0,0,0,0,0,0,0,0,0,0,0,0,0,Drama,A woman's seaside vacation takes a dark turn when her obsession with a young mother forces her to confront secrets from her past.,mother based on novel or book beach greece daughter vacation doll motherhood woman director 
288,503919,The Lighthouse,7.5,Robert Eggers,0,1,0,1,1,0,0,0,0,1,0,0,0,0,0,0,0,0,0,Drama,Two lighthouse keepers try to maintain their sanity while living on a remote and mysterious New England island in the 1890s.,secret isolation island nightmare hallucination lighthouse mermaid lighthouse keeper    black and white storm male masturbation new england madness psychological horror drunkenness 19th century isolated island 
289,324849,The Lego Batman Movie,6.5,Chris McKay,0,1,1,0,0,1,1,0,0,0,0,0,1,0,0,0,1,0,0,Animation,"A cooler-than-ever Bruce Wayne must deal with the usual suspects as they plan to rule Gotham City, while discovering that he has accidentally adopted a teenage orphan who wishes to become his sidekick.",dc comics superhero based on comic based on toy spin off super power dead parents lego 
290,10196,The Last Airbender,4.5,M. Night Shyamalan,1,1,0,0,0,1,0,0,0,0,0,0,0,0,0,0,0,0,0,Action,"The story follows the adventures of Aang, a young successor to a long line of Avatars, who must put his childhood ways aside and stop the Fire Nation from enslaving the Water, Earth and Air nations.",fire war ship prince kingdom village arrest remake based on cartoon attack avatar air spirit domination cheering 
291,45269,The King's Speech,8.1,Tom Hooper,0,0,0,1,0,0,0,1,0,0,0,0,0,0,0,0,0,0,0,Drama,"The King's Speech tells the story of the man who became King George VI, the father of Queen Elizabeth II. After his brother abdicates, George ('Bertie') reluctantly assumes the throne. Plagued by a dreaded stutter and considered unfit to be king, Bertie engages the help of an unorthodox speech therapist named Lionel Logue. Through a set of unexpected techniques, and as a result of an unlikely friendship, Bertie is able to find his voice and boldly lead the country into war.",great britain radio monarchy stutter palace radio transmission royal family speech marriage based on a true story royalty death of father historical fiction 1930s george vi winston churchill speech therapy corgi 
292,399057,The Killing of a Sacred Deer,8.5,Yorgos Lanthimos,0,0,0,1,0,0,0,0,0,1,0,0,0,1,0,0,0,0,0,Drama,"Dr. Steven Murphy is a renowned cardiovascular surgeon who presides over a spotless household with his wife and two children. Lurking at the margins of his idyllic suburban existence is Martin, a fatherless teen who insinuates himself into the doctor's life in gradually unsettling ways.",husband wife relationship hostage blackmail surgeon paralysis insanity psychopath horror revenge paranormal dysfunctional family hospital cruelty brutality cafe cardiologist recovering alcoholic psychological horror open heart surgery 
293,10098,The Kid,7.9,Charlie Chaplin,0,0,0,1,0,0,1,0,0,0,0,0,0,0,0,0,0,0,0,Comedy,A tramp cares for a boy after he's abandoned as a newborn by his mother. Later the mother has a change of heart and aches to be reunited with her son.,angel suicide attempt fistfight slapstick black and white class differences foundling silent film dream sequence semi autobiographical car theft little tramp illegitimate child unwed mother abandoned baby out of wedlock child raised like own child good deed doer 
294,29460,The Juniper Tree,6.5,Nietzchka Keene,0,1,0,1,0,0,0,0,0,0,0,0,0,0,0,0,0,0,0,Drama,"Margit and her older sister Katla flee for safety after their mother is burned to death for witchcraft. Finding shelter with Johan and his resentful young son, Jonas, the sisters help form an impromptu family unit that’s soon strained by Katla’s burgeoning sorcery.",fairy tale brothers grimm iceland woman director 
295,496243,Parasite,8.1,Bong Joon-ho,0,0,0,1,0,0,1,0,0,1,0,0,0,0,0,0,0,0,0,Comedy,"All unemployed, Ki-taek's family takes peculiar interest in the wealthy and glamorous Parks for their livelihood until they get entangled in an unexpected incident.",birthday party private lessons basement dark comedy con artist working class psychological thriller class differences housekeeper tutor family crime family unemployed wealthy family 
296,9671,Crocodile Dundee,6.5,Peter Faiman,1,0,0,0,0,0,1,0,0,0,0,0,0,0,0,0,0,0,0,Adventure,"When a New York reporter plucks crocodile hunter Dundee from the Australian Outback for a visit to the Big Apple, it's a clash of cultures and a recipe for good-natured comedy as naïve Dundee negotiates the concrete jungle. Dundee proves that his instincts are quite useful in the city and adeptly handles everything from wily muggers to high-society snoots without breaking a sweat.",new york city prostitute hotel journalist culture clash subway crocodile wilderness knife tourist limousine poacher fish out of water adventurer australian outback kangaroo 
297,1990,Paranoid Park,7.9,Gus Van Sant,0,0,0,1,0,0,0,0,0,0,1,0,0,1,0,0,0,0,0,Mystery,"Alex, a teenaged skateboarder, is interviewed by Detective Richard Lu about the death of a security guard severed by a train who was apparently hit by a skateboard. While dealing with the separation process of his parents and the sexual heat of his virgin girlfriend Jennifer, Alex writes his last experiences in Paranoid Park with his new acquaintances and how the guard was killed, trying to relieve his feeling of guilty from his conscience.",decision fall teen angst fatal accident flash forward break-up teenage boy security guard nonlinear timeline torso cut in half skateboarder autumn skate park questioning 
298,407448,Detroit,9.2,Kathryn Bigelow,0,0,0,1,0,0,0,1,0,1,1,0,0,0,0,0,0,0,0,Crime,A police raid in Detroit in 1967 results in one of the largest citizens' uprisings in the history of the United States.,"fire police brutality church choir based on a true story murder beating racism church detroit, michigan 1960s "
299,74308,Detachment,8.5,Tony Kaye,0,0,0,1,0,0,0,0,0,0,0,0,0,0,0,0,0,0,0,Drama,"A chronicle of three weeks in the lives of several high school teachers, administrators and students through the eyes of substitute teacher, Henry Barthes. Henry roams from school to school, imparting modes of knowledge, but never staying long enough to form any semblance of sentient attachment.",falsely accused depression classroom grandfather unhappiness animal abuse 
300,505706,The Golden Glove,7.0,Fatih Akın,0,0,0,1,1,0,0,0,0,1,1,0,0,0,0,0,0,0,0,Drama,A serial killer strikes fear in the hearts of residents of Hamburg during the early 1970s.,"prostitute based on novel or book 1970s red-light district alcoholism based on a true story serial killer teenage girl misogyny hamburg, germany drunkenness "
