,tmdb_id,title,evaluation,Director_0,Adventure,Fantasy,Animation,Drama,Horror,Action,Comedy,History,Western,Thriller,Crime,Documentary,Science Fiction,Mystery,Music,Romance,Family,War,TV Movie,primary genre,overview,keywords
98,571,The Birds,8.0,Alfred Hitchcock,0,0,0,0,1,0,0,0,0,0,0,0,0,0,0,0,0,0,0,Horror,"Chic socialite Melanie Daniels enjoys a passing flirtation with an eligible attorney in a San Francisco pet shop and, on an impulse, follows him to his hometown bearing a gift of lovebirds. But upon her arrival, the bird population runs amok. Suddenly, the townsfolk face a massive avian onslaught, with the feathered fiends inexplicably attacking people all over Bodega Bay.",pet shop seclusion playground seagull fireplace bird attack socialite based on short story practical joke schoolteacher lovebird shopkeeper unsolved mystery schoolhouse 
99,399019,The Beguiled,6.5,Sofia Coppola,0,0,0,1,0,0,0,0,0,0,0,0,0,0,0,0,0,0,0,Drama,"During the Civil War, at a Southern girls’ boarding school, young women take in an injured enemy soldier. As they provide refuge and tend to his wounds, the house is taken over with sexual tension and dangerous rivalries, and taboos are broken in an unexpected turn of events.",based on novel or book remake sexual tension period drama union soldier virginia american civil war woman director confederacy all girls school 19th century girls' school 
100,537996,The Ballad of Buster Scruggs,7.0,Joel Coen,0,0,0,1,0,0,1,0,1,0,0,0,0,0,0,0,0,0,0,Comedy,"Vignettes weaving together the stories of six individuals in the old West at the end of the Civil War. Following the tales of a sharp-shooting songster, a wannabe bank robber, two weary traveling performers, a lone gold prospector, a woman traveling the West to an uncertain future, and a motley crew of strangers undertaking a carriage ride.",prostitute musical anthology parody native american bank robbery stagecoach cowboy wagon train singing cowboy american west the old west 
101,10515,Castle in the Sky,8.3,Hayao Miyazaki,1,1,1,0,0,1,0,0,0,0,0,0,0,0,0,1,1,0,0,Adventure,A young boy and a girl with a magic crystal must race against pirates and foreign agents in a search for a legendary floating castle.,flying mine magic castle lost civilisation army pirate orphan government agent floating pendant blue sky air pirate crystal anime 
102,103,Taxi Driver,8.9,Martin Scorsese,0,0,0,1,0,0,0,0,0,0,1,0,0,0,0,0,0,0,0,Crime,"A mentally unstable Vietnam War veteran works as a night-time taxi driver in New York City where the perceived decadence and sleaze feed his urge for violent action, attempting to save a preadolescent prostitute in the process.",new york city vietnam veteran taxi pornography obsession pimp taxi driver drug dealer politician firearm vigilante junk food alienation misanthrophy illegal prostitution character study loner neo-noir child prostitution new hollywood drives 
103,10312,Patch Adams,8.0,Tom Shadyac,0,0,0,1,0,0,1,0,0,0,0,0,0,0,0,0,0,0,0,Comedy,"The true story of Dr. Hunter ""Patch"" Adams, who in the 1970s found that humor is the best medicine, and was willing to do just anything to make his patients laugh—even if it meant risking his own career.",nurse hospital doctor laughter 
104,765,Evil Dead II,8.1,Sam Raimi,0,1,0,0,1,0,1,0,0,0,0,0,0,0,0,0,0,0,0,Horror,"Ash Williams and his girlfriend Linda find a log cabin in the woods with a voice recording from an archeologist who had recorded himself reciting ancient chants from ""The Book of the Dead."" As they play the recording an evil power is unleashed taking over Linda's body.",deer blood splatter tape recorder chainsaw spirit over the top cult film book of the dead evil dead eyeball necronomicon tarmac meat cleaver psychotronic 
105,641662,Pieces of a Woman,7.0,Kornél Mundruczó,0,0,0,1,0,0,0,0,0,0,0,0,0,0,0,0,0,0,0,Drama,"When a young mother's home birth ends in unfathomable tragedy, she begins a year-long odyssey of mourning that fractures relationships with loved ones in this deeply personal story of a woman learning to live alongside her loss.","loss of loved one boston, massachusetts midwife grief home birth grieving giving birth loss of child "
106,39513,Paul,6.1,Greg Mottola,1,0,0,0,0,0,1,0,0,0,0,0,1,0,0,0,0,0,0,Adventure,"For the past 60 years, a space-traveling smart-ass named Paul has been locked up in a top-secret military base, advising world leaders about his kind. But when he worries he’s outlived his usefulness and the dissection table is drawing uncomfortably close, Paul escapes on the first RV that passes by his compound in Area 51. Fortunately, it contains the two earthlings who are most likely to rescue and harbor an alien on the run.","san diego, california alien area 51 alien space craft duringcreditsstinger 1980s "
107,37997,Permanent Vacation,7.0,Jim Jarmusch,0,0,0,1,0,0,0,0,0,0,0,0,0,0,0,0,0,0,0,Drama,"In downtown Manhattan, a twenty-something boy whose Father is not around and whose Mother is institutionalized, is a big Charlie Parker fan. He almost subconsciously searches for more meaning in his life and meets a few characters along the way.",new york city saxophone drifter mental illness 
108,353571,Tallulah,4.0,Siân Heder,0,0,0,1,0,0,0,0,0,0,0,0,0,0,0,0,0,0,0,Drama,"Desperate to be rid of her toddler, a dissatisfied Beverly Hills housewife hires a stranger to babysit and ends up getting much more than she bargained for.",baby van painting money theft book signing reading a book woman director 
109,8681,Taken,6.9,Pierre Morel,0,0,0,0,0,1,0,0,0,1,0,0,0,0,0,0,0,0,0,Action,"While vacationing with a friend in Paris, an American girl is kidnapped by a gang of human traffickers intent on selling her into forced prostitution. Working against the clock, her ex-spy father must pull out all the stops to save her. But with his best years possibly behind him, the job may be more than he can handle.","paris, france kidnapping human trafficking horror rescue prostitution albanian rape and revenge missing daughter ex-cia agent abduction "
110,577922,Tenet,8.2,Christopher Nolan,0,0,0,0,0,1,0,0,0,1,0,0,1,0,0,0,0,0,0,Action,"Armed with only one word - Tenet - and fighting for the survival of the entire world, the Protagonist journeys through a twilight world of international espionage on a mission that will unfold in something beyond real time.","spy assassin mumbai (bombay), india time travel arms dealer espionage terrorism terrorist attack nuclear weapons terrorist plot alternate timeline time paradox kiev russia spy thriller "
111,180863,T2 Trainspotting,7.4,Danny Boyle,0,0,0,1,0,0,0,0,0,0,1,0,0,0,0,0,0,0,0,Crime,"After 20 years abroad, Mark Renton returns to Scotland and reunites with his old friends Sick Boy, Spud and Begbie.","prison scotland based on novel or book fight drug addiction blackmail cocaine nightclub junkie heroin edinburgh, scotland friendship addiction sequel revenge prison escape extortion theft bar fight council estate eastern european "
112,400617,Phantom Thread,7.3,Paul Thomas Anderson,0,0,0,1,0,0,0,0,0,0,0,0,0,0,0,1,0,0,0,Drama,"In 1950s London, renowned British dressmaker Reynolds Woodcock comes across Alma, a young, strong-willed woman, who soon becomes ever present in his life as his muse and lover.","london, england husband wife relationship obsession dressmaker fashion designer doctor wedding fashion fashion show haute couture 1950s brother sister relationship "
113,582014,Promising Young Woman,7.3,Emerald Fennell,0,0,0,1,0,0,0,0,0,1,1,0,0,0,0,0,0,0,0,Thriller,"A young woman, traumatized by a tragic event in her past, seeks out vengeance against those who crossed her path.",ohio coffee shop psychopath horror sociopath revenge predator turns victim childhood friends rape and revenge woman director medical school pediatrician living with parents barista female psychopath sexual predator nice guy prosocial psychopath 
114,567410,System Crasher,7.8,Nora Fingscheidt,0,0,0,1,0,0,0,0,0,0,0,0,0,0,0,0,0,0,0,Drama,"On her wild quest for love, 9-year-old Benni's untamed energy drives everyone around her to despair.",系统破坏者 
115,181808,Star Wars: The Last Jedi,6.5,Rian Johnson,1,0,0,0,0,1,0,0,0,0,0,0,1,0,0,0,0,0,0,Science Fiction,"Rey develops her newly discovered abilities with the guidance of Luke Skywalker, who is unsettled by the strength of her powers. Meanwhile, the Resistance prepares to do battle with the First Order.",bunker space battle failure defeat sequel space opera stormtrooper military operation 
116,22538,Scott Pilgrim vs. the World,8.0,Edgar Wright,0,1,0,0,0,1,1,0,0,0,0,0,0,0,0,1,0,0,0,Action,"As bass guitarist for a garage-rock band, Scott Pilgrim has never had trouble getting a girlfriend; usually, the problem is getting rid of them. But when Ramona Flowers skates into his heart, he finds she has the most troublesome baggage of all: an army of ex-boyfriends who will stop at nothing to eliminate him from her list of suitors.","video game canada ex-boyfriend toronto, canada animated scene based on graphic novel whipping hipster underage girlfriend unconsciousness girl fight vegan aftercreditsstinger "
117,539,Psycho,8.0,Alfred Hitchcock,0,0,0,1,1,0,0,0,0,1,0,0,0,0,0,0,0,0,0,Horror,"When larcenous real estate clerk Marion Crane goes on the lam with a wad of cash and hopes of starting a new life, she ends up at the notorious Bates Motel, where manager Norman Bates cares for his housebound mother.",hotel clerk arizona shower rain motel taxidermy money secretary black and white corpse murderer theft mental illness private detective missing person proto-slasher 
118,680,Pulp Fiction,9.6,Quentin Tarantino,0,0,0,0,0,0,0,0,0,1,1,0,0,0,0,0,0,0,0,Thriller,"A burger-loving hit man, his philosophical partner, a drug-addled gangster's moll and a washed-up boxer converge in this sprawling, comedic crime caper. Their adventures unfurl in three stories that ingeniously trip back and forth in time.","drug dealer boxer massage stolen money crime boss dance competition briefcase redemption heirloom los angeles, california theft nonlinear timeline neo-noir shared universe "
119,614,Wild Strawberries,7.9,Ingmar Bergman,0,0,0,1,0,0,0,0,0,0,0,0,0,0,0,0,0,0,0,Drama,"Crotchety retired doctor Isak Borg travels from Stockholm to Lund, Sweden, with his pregnant and unhappy daughter-in-law, Marianne, in order to receive an honorary degree from his alma mater. Along the way, they encounter a series of hitchhikers, each of whom causes the elderly doctor to muse upon the pleasures and failures of his own life. These include the vivacious young Sara, a dead ringer for the doctor's own first love.",adultery identity dream journey in the past professor nightmare aging faith road trip child acceptance 
120,22970,The Cabin in the Woods,7.1,Drew Goddard,0,1,0,0,1,0,1,0,0,1,0,0,0,0,0,0,0,0,0,Horror,"Five college friends spend the weekend at a remote cabin in the woods, where they get more than they bargained for. Together, they must discover the truth behind the cabin in the woods.",cabin giant snake school party motorcycle crash abandoned house woods marijuana apocalypse zombie werewolf creature cabin in the woods video wall speaker phone young adult college student 
121,264644,Room,8.4,Lenny Abrahamson,0,0,0,1,0,0,0,0,0,1,0,0,0,0,0,0,0,0,0,Drama,"Held captive for 7 years in an enclosed space, a woman and her young son finally gain their freedom, allowing the boy to experience the outside world for the first time.",based on novel or book carpet isolation kidnapping imprisonment grandparents escape hospital dog captive children's perspectives skylight mother son relationship 
122,1580,Rope,8.5,Alfred Hitchcock,0,0,0,1,0,0,0,0,0,1,1,0,0,0,0,0,0,0,0,Crime,Two men attempt to prove they committed the perfect crime by hosting a dinner party after strangling their former classmate to death.,banquet footlocker strangle rope murder based on play or musical long take technicolor 
123,12405,Slumdog Millionaire,8.0,Danny Boyle,0,0,0,1,0,0,0,0,0,0,0,0,0,0,0,1,0,0,0,Drama,"Jamal Malik is an impoverished Indian teen who becomes a contestant on the Hindi version of ‘Who Wants to Be a Millionaire?’ but, after he wins, he is suspected of cheating.","slum cheating suspicion mumbai (bombay), india game show quiz orphan duringcreditsstinger taj mahal, india "
124,223485,Slow West,7.8,John Maclean,0,0,0,1,0,1,0,0,1,1,0,0,0,0,0,0,0,0,0,Western,"In the Old West, a 17-year-old Scottish boy teams up with a mysterious gunman to find the woman with whom he is infatuated.",fire bounty hunter shotgun horseback riding horse cabin frontier outlaw flashback rifle unrequited love death of father native american shootout search accidental death ireland drinking pursuit flaming arrow dream sequence 
125,96721,Rush,7.4,Ron Howard,0,0,0,1,0,1,0,0,0,0,0,0,0,0,0,0,0,0,0,Drama,A biographical drama centered on the rivalry between Formula 1 drivers James Hunt and Niki Lauda during the 1976 Formula One motor-racing season.,car race world champion sports based on a true story adventurer formula one (f1) 
126,413043,Safari,7.9,Ulrich Seidl,0,0,0,0,0,0,0,0,0,0,0,1,0,0,0,0,0,0,0,Documentary,"Africa. In the wild expanses, where bush-bucks, impalas, zebras, gnus and other creatures graze by the thousands, they are on holiday. German and Austrian hunting tourists drive through the bush, lie in wait, stalk their prey. They shoot, sob with excitement and pose before the animals they have bagged. A vacation movie about killing, a movie about human nature.",africa safari hunting animal death 
127,49853,Same Same But Different,6.5,Detlev Buck,0,0,0,1,0,0,0,0,0,0,0,0,0,0,0,1,0,0,0,Drama,"Based on the true story of Benjamin Prufer and Sreykeo Solvan. The unexpected and uncertain love story of Sreykeo, a 21 year old bar girl in Phnom Penh and Ben, a young German student traveling to Cambodia on a post graduation summer trip. When Ben returns home to Germany he discovers that Sreyko is sick and he takes on the responsibility to save her. On the way he discovers a world where not everyone is dealt the same cards and where motivations are not always pure.",0
128,423422,My Brother Simple,5.9,Markus Goller,0,0,0,1,0,0,0,0,0,0,0,0,0,0,0,0,0,0,0,Drama,"Ben and Barnabas are unseparatable since they are small. The two of them, however, are no ordinary pair of brothers, for Barnabas, with his twenty-two years, remained mentally at the age of three.",0
129,9675,Sideways,6.9,Alexander Payne,0,0,0,1,0,0,1,0,0,0,0,0,0,0,0,1,0,0,0,Comedy,"Two middle-aged men embark on a spiritual journey through Californian wine country. One is an unpublished novelist suffering from depression, and the other is only days away from walking down the aisle.","california based on novel or book golf wine road trip stag night marijuana writer buddy santa barbara, california winery wine tasting "
130,11324,Shutter Island,9.2,Martin Scorsese,0,0,0,1,0,0,0,0,0,1,0,0,0,1,0,0,0,0,0,Drama,"World War II soldier-turned-U.S. Marshal Teddy Daniels investigates the disappearance of a patient from a hospital for the criminally insane, but his efforts are compromised by his troubling visions and also by a mysterious doctor.",based on novel or book island hurricane investigation psychiatric hospital u.s. marshal conspiracy theory psychological thriller whodunit neo-noir 1950s 
131,111,Scarface,8.8,Brian De Palma,0,0,0,1,0,1,0,0,0,1,1,0,0,0,0,0,0,0,0,Action,"After getting a green card in exchange for assassinating a Cuban government official, Tony Montana stakes a claim on the drug trade in Miami. Viciously murdering anyone who stands in his way, Tony eventually becomes the biggest drug lord in the state, controlling nearly all the cocaine that comes through Miami. But increased pressure from the police, wars with Colombian drug cartels and his own drug-fueled paranoia serve to fuel the flames of his eventual downfall.","sibling relationship miami, florida corruption loss of loved one cuba prohibition era cocaine gangster rise and fall remake drug cartel mafia drug lord bitterness rise to power miami beach cuban refugees drug war "
132,424,Schindler's List,7.9,Steven Spielberg,0,0,0,1,0,0,0,1,0,0,0,0,0,0,0,0,0,1,0,Drama,The true story of how businessman Oskar Schindler saved over a thousand Jewish lives from the Nazis while they worked as slaves in his factory during World War II.,"based on novel or book factory concentration camp hero holocaust (shoah) ss (nazi schutzstaffel) world war ii ghetto jew persecution kraków, poland auschwitz-birkenau concentration camp industrialist nazi defense industry biography based on a true story historical fiction train poland weapons manufacturer "
133,664300,Shiva Baby,7.3,Emma Seligman,0,0,0,1,0,0,1,0,0,0,0,0,0,0,0,0,0,0,0,Comedy,"College student Danielle must cover her tracks when she unexpectedly runs into her sugar daddy at a shiva - with her parents, ex-girlfriend and family friends also in attendance.",new york city parent child relationship ex-girlfriend jewish life bisexuality coming of age lgbt woman director jewish culture college student sugar daddy mourning ritual based on short film 
134,333555,Schneider vs. Bax,6.5,Alex van Warmerdam,0,0,0,0,0,0,1,0,0,1,0,0,0,1,0,0,0,0,0,Comedy,"On his birthday, a hitman reluctantly takes on the easy task of killing a writer, only to find the job a lot more difficult than expected.",birthday hitman writer criminal mastermind 
135,76025,Shame,7.1,Steve McQueen,0,0,0,1,0,0,0,0,0,0,0,0,0,0,0,0,0,0,0,Drama,"Brandon, a thirty-something man living in New York, eludes intimacy with women but feeds his deepest desires with a compulsive addiction to sex. When his younger sister temporarily moves into his apartment, stirring up bitter memories of their shared painful past, Brandon's life, like his fragile mind, gets out of control.",new york city pornography sex addiction co-worker relationship internet porn self-loathing brother sister relationship 
136,978,Seven Years in Tibet,6.7,Jean-Jacques Annaud,1,0,0,1,0,0,0,1,0,0,0,0,0,0,0,0,0,0,0,Adventure,"Austrian mountaineer, Heinrich Harrer journeys to the Himalayas without his family to head an expedition in 1939. But when World War II breaks out, the arrogant Harrer falls into Allied forces' hands as a prisoner of war. He escapes with a fellow detainee and makes his way to Llaso, Tibet, where he meets the 14-year-old Dalai Lama, whose friendship ultimately transforms his outlook on life.",buddhism himalaya austria mountain buddhist monk world war ii prisoner of war monsoon tibet dalai lama mountaineer lhasa wedding based on memoir or autobiography people's liberation army 
137,6547,Schtonk!,6.3,Helmut Dietl,0,0,0,0,0,0,1,1,0,0,0,0,0,0,0,0,0,0,0,History,"Schtonk! is a farce of the actual events of 1983, when Germany's Stern magazine published, with great fanfare, 60 volumes of the alleged diaries of Adolf Hitler – which two weeks later turned out to be entirely fake.  Fritz Knobel (based on real-life forger Konrad Kujau) supports himself by faking and selling Nazi memorabilia. When Knobel writes and sells a volume of Hitler's (nonexistent) diaries, he thinks it's just another job.  When sleazy journalist Hermann Willié learns of the diaries, however, he quickly realizes their potential value... and Knobel is quickly in over his head. As the pressure builds and Knobel is forced to deliver more and more volumes of the fake diaries, he finds himself acting increasingly like the man whose life he is rewriting. The film is a romping and hilarious satire, poking fun not only at the events and characters involved in the hoax (who are only thinly disguised in the film), but at the discomfort Germany has with its difficult past.",nazi diary portrait painting fake adolf hitler 
138,86838,Seven Psychopaths,6.3,Martin McDonagh,0,0,0,0,0,0,1,0,0,0,1,0,0,0,0,0,0,0,0,Comedy,A struggling screenwriter inadvertently becomes entangled in the Los Angeles criminal underworld after his oddball friends kidnap a gangster's beloved Shih Tzu.,"suicide alcohol screenwriter underworld fight kidnapping gangster black humor murder scam los angeles, california explosion criminal shih tzu struggling neo-noir "
139,8653,The Isle,8.0,Kim Ki-duk,0,0,0,1,0,0,0,0,0,1,0,0,0,0,0,0,0,0,0,Drama,"Mute Hee-Jin is working as a clerk in a fishing resort in the Korean wilderness; selling baits, food and occasionally her body to the fishing tourists. One day she falls in love with Hyun-Shik, who is on the run from the police, and rescues him with a fish hook when he tries to commit suicide.",prostitute jealousy card game eroticism island liquor sadomasochism 
140,129,Spirited Away,7.9,Hayao Miyazaki,0,1,1,0,0,0,0,0,0,0,0,0,0,0,0,0,1,0,0,Animation,"A young girl, Chihiro, becomes trapped in a strange new world of spirits. When her parents undergo a mysterious transformation, she must call upon the courage she never knew she had to free her family.",witch parent child relationship magic darkness bath house spirit parallel world amusement park youkai japanese mythology anime 
141,377151,Fire at Sea,7.5,Gianfranco Rosi,0,0,0,0,0,0,0,0,0,0,0,1,0,0,0,0,0,0,0,Documentary,"Capturing life on the Italian island of Lampedusa, a frontline in the European migrant crisis.",migration 
142,107,Snatch,7.0,Guy Ritchie,0,0,0,0,0,0,1,0,0,0,1,0,0,0,0,0,0,0,0,Crime,"Unscrupulous boxing promoters, violent bookmakers, a Russian gangster, incompetent amateur robbers and supposedly Jewish jewelers fight to track down a priceless stolen diamond.",england gypsy gambling bare knuckle boxing slang robbery trailer park antwerp boxer gangster pig underground fighting cult film diamond heist pikey 
143,348350,Solo: A Star Wars Story,6.0,Ron Howard,1,0,0,0,0,1,0,0,0,0,0,0,1,0,0,0,0,0,0,Science Fiction,"Through a series of daring escapades deep within a dark and dangerous criminal underworld, Han Solo meets his mighty future copilot Chewbacca and encounters the notorious gambler Lando Calrissian.",spacecraft smuggling (contraband) prequel spin off space opera 
144,426426,Roma,7.9,Alfonso Cuarón,0,0,0,1,0,0,0,0,0,0,0,0,0,0,0,0,0,0,0,Drama,"In 1970s Mexico City, two domestic workers help a mother of four while her husband is away for an extended period of time.","1970s mexico city, mexico middle class family relationships black and white maid autobiographical master servant relationship domestic worker "
145,314365,Spotlight,7.0,Tom McCarthy,0,0,0,1,0,0,0,1,0,1,0,0,0,0,0,0,0,0,0,Drama,"The true story of how the Boston Globe uncovered the massive scandal of child molestation and cover-up within the local Catholic Archdiocese, shaking the entire Catholic Church to its core.","child abuse journalism newspaper judge florida boston, massachusetts pedophilia sex scandal victim court cover-up based on a true story priest conspiracy lawyer historical fiction catholic catholic church lgbt catholicism child molestation archdiocese investigative journalism cardinal "
146,536743,Queen & Slim,7.3,Melina Matsoukas,0,0,0,1,0,0,0,0,0,0,1,0,0,0,0,1,0,0,0,Drama,"While on a forgettable first date together in Ohio, a black man and a black woman are pulled over for a minor traffic infraction. The situation escalates, with sudden and tragic results.",on the run police officer killed black activist racist cop first date woman director killer on the run 
147,9647,Scrooged,7.8,Richard Donner,0,1,0,1,0,0,1,0,0,0,0,0,0,0,0,0,0,0,0,Fantasy,"Frank Cross is a wildly successful television executive whose cold ambition and curmudgeonly nature has driven away the love of his life. But after firing staff member Eliot Loudermilk  on Christmas Eve, Frank is visited by a series of ghosts who give him a chance to re-evaluate his actions and right the wrongs of his past.",holiday tv ratings ghost duringcreditsstinger christmas music christmas 
148,1892,Return of the Jedi,7.4,Richard Marquand,1,0,0,0,0,1,0,0,0,0,0,0,1,0,0,0,0,0,0,Adventure,"Luke Skywalker leads a mission to rescue his friend Han Solo from the clutches of Jabba the Hutt, while the Emperor seeks to destroy the Rebellion once and for all with a second dreaded Death Star.",sibling relationship rebel spacecraft emperor space battle matter of life and death death star jabba the hutt ewoks space opera 
149,1891,The Empire Strikes Back,8.5,Irvin Kershner,1,0,0,0,0,1,0,0,0,0,0,0,1,0,0,0,0,0,0,Adventure,"The epic saga continues as Luke Skywalker, in hopes of defeating the evil Galactic Empire, learns the ways of the Jedi from aging master Yoda. But Darth Vader is more determined than ever to capture Luke. Meanwhile, rebel leader Princess Leia, cocky Han Solo, Chewbacca, and droids C-3PO and R2-D2 are thrown into various stages of capture, betrayal and despair.",rebel android asteroid spacecraft space battle snowstorm space colony lightsaber rebellion the force space opera stormtrooper wookie jedi master jedi training droid 
150,333339,Ready Player One,8.0,Steven Spielberg,1,0,0,0,0,1,0,0,0,0,0,0,1,0,0,0,0,0,0,Science Fiction,"When the creator of a popular video game system dies, a virtual contest is created to compete for his fortune.","video game based on novel or book future virtual reality dystopia nostalgia love evil corporation quest 1980s 2040s based on young adult novel columbus, ohio "
151,265195,Wild Tales,8.3,Damián Szifron,0,0,0,1,0,0,1,0,0,1,0,0,0,0,0,0,0,0,0,Drama,Six deadly stories that explore the extremities of human behaviour involving distressed people seeking revenge.,horror anthology revenge dark comedy wedding party road rage horror comedy 
152,61791,Rise of the Planet of the Apes,8.4,Rupert Wyatt,0,0,0,1,0,1,0,0,0,1,0,0,1,0,0,0,0,0,0,Thriller,"A highly intelligent chimpanzee named Caeser has been living a peaceful suburban life ever since he was born. But when he gets taken to a cruel primate facility, Caeser decides to revolt against those who have harmed him.",intelligence zoo cage dystopia alzheimer's disease golden gate bridge ape monkey medical research 
